academy_id, academy_name, road_address, building, address, sido, sigungu, dong, zip_code, latitude, longitude
1,(상계분원)오메가수학학원, 서울 노원구 한글비석로 460, 백산빌딩, 서울 노원구 상계동 455, 서울, 노원구, 상계5동, 139820, 127.06697859544342, 37.66444002512082
2,(주)그루샘수학보습학원, 서울 강남구 도곡로 451, 한나빌딩, 서울 강남구 대치동 941-22, 서울, 강남구, 대치4동, 135999, 127.05975114071488, 37.498884549015784
3,(주)멘토르수학전문학원, 서울 강남구 남부순환로 2909, 여천빌딩, 서울 강남구 대치동 651, 서울, 강남구, 대치1동, 135838, 127.0574118750373, 37.49218221925881
4,(주)산에듀김영준국어논술전문별관학원, 서울 강남구 선릉로62길 27, , 서울 강남구 대치동 935-33, 서울, 강남구, 대치4동, 135998, 127.05475642710299, 37.49785621854038
5,(주)산에듀김영준국어논술전문학원, 서울 강남구 도곡로 409, 타워엠프리스, 서울 강남구 대치동 938-22, 서울, 강남구, 대치4동, 135998, 127.05516770344329, 37.497369483749004
6,(주)산에듀풍요로운아이학원, 서울 강남구 선릉로62길 33, 장성빌딩, 서울 강남구 대치동 935-26, 서울, 강남구, 대치4동, 135998, 127.05506865389927, 37.49800383844723
7,(주)지유에듀테인먼트원격학원, 서울 금천구 가산디지털1로 2, 우림라이온스밸리2차, 서울 금천구 가산동 680, 서울, 금천구, 가산동, 153776, 126.88800033768293, 37.46683554505061
8,(주)진인사보습학원, 서울 양천구 신목로5길 13, , 서울 양천구 신정동 281-1, 서울, 양천구, 신정2동, 158852, 126.87253157157878, 37.51765827506557
9,(주)케이엔에스에듀고등관대치본점학원, 서울 강남구 삼성로 238, 태원 리치타운상가, 서울 강남구 대치동 989, 서울, 강남구, 대치2동, 135501, 127.0613974936218, 37.49863142310217
10,1%유클리드학원, 서울 성동구 뚝섬로 317-1, 성수가야피아노학원, 서울 성동구 성수동1가 656-1828, 서울, 성동구, 성수1가1동, 133821, 127.04647829957817, 37.54129532072585
11,1%하이스트영어수학학원, 서울 은평구 증산서길 64-14, 삼우빌딩, 서울 은평구 증산동 176-15, 서울, 은평구, 증산동, 122937, 126.90599214745465, 37.58189477767986
12,1.4수학전문학원, 서울 서초구 동광로12가길 3, 인재빌딩, 서울 서초구 방배동 1423, 서울, 서초구, 방배4동, 137852, 126.98469928347204, 37.48739821348906
13,1095보습학원, 서울 광진구 광나루로 588, 임애빌딩, 서울 광진구 구의동 202-5, 서울, 광진구, 구의3동, 143821, 127.0938454513368, 37.54269075657135
14,11월의기적학원, 서울 노원구 중계로 172-6, 성장빌딩, 서울 노원구 중계동 84-6, 서울, 노원구, 중계본동, 139855, 127.08137504734805, 37.650069321463874
15,11월의약속보습학원, 서울 송파구 송이로31길 20, , 서울 송파구 문정동 128-8, 서울, 송파구, 장지동, 138200, 127.13301507096944, 37.489284918683325
16,11월의혁명보습학원, 서울 양천구 오목로50길 33, , 서울 양천구 신정동 1007-3, 서울, 양천구, 신정4동, 158860, 126.86463525043233, 37.523116771651075
17,1230깊은생각학원, 서울 동작구 상도로 26-1, , 서울 동작구 대방동 402-30, 서울, 동작구, 대방동, 156811, 126.92350652492738, 37.49966777980246
18,1318영어학원, 서울 양천구 목동서로 67, 우성에펠타운빌딩, 서울 양천구 목동 907-4, 서울, 양천구, 목5동, 158708, 126.87855064793938, 37.536398239962146
19,153수학학원, 서울 광진구 광나루로54길 32, 하나빌딩, 서울 광진구 구의동 199-20, 서울, 광진구, 구의3동, 143821, 127.0951132129887, 37.53947137196485
20,1:1명품코칭학원, 서울 강북구 삼양로19길 59, 대선빌딩, 서울 강북구 미아동 1267-56, 서울, 강북구, 삼각산동, 142818, 127.01936825929101, 37.61573940776988
21,1:1학원, 서울 노원구 동일로 1419, 디와이홀딩스(주)빌딩, 서울 노원구 상계동 711-12, 서울, 노원구, 상계6.7동, 139942, 127.05984453233323, 37.65530790754246
22,1st강북보습학원, 서울 강북구 한천로 981, , 서울 강북구 번동 412-52, 서울, 강북구, 번1동, 142864, 127.03156438084146, 37.636654084974616
23,1관연세멘토학원, 서울 은평구 진관1로 21-10, 은평뉴타운 박석고개, 서울 은평구 진관동 102, 서울, 은평구, 진관동, 122731, 126.91939898030337, 37.63427019489463
24,1관이진주영어학원, 서울 은평구 가좌로 179, , 서울 은평구 응암동 747-1, 서울, 은평구, 응암3동, 122952, 126.92062288947696, 37.58705559849961
25,1교시언어영역학원, 서울 마포구 백범로 108, , 서울 마포구 대흥동 202-13, 서울, 마포구, 대흥동, 121809, 126.94317067951394, 37.54710043617028
26,211수학(MATH)학원, 서울 동대문구 장한로 179, , 서울 동대문구 장안동 302-3, 서울, 동대문구, 장안2동, 130838, 127.07174490778337, 37.576475613295855
27,21세기명문보습학원, 서울 송파구 송파대로18길 20, , 서울 송파구 문정동 64-14, 서울, 송파구, 문정1동, 138826, 127.12575311235778, 37.485007679741145
28,21세기보습학원, 서울 광진구 아차산로 484, , 서울 광진구 구의동 199-6, 서울, 광진구, 구의3동, 143821, 127.0956443894033, 37.54075396646637
29,21세기사고력학원, 서울 마포구 희우정로 45, , 서울 마포구 합정동 444-7, 서울, 마포구, 합정동, 121888, 126.90635263077931, 37.550781881837985
30,21세기수학보습학원, 서울 강남구 학동로42길 73, , 서울 강남구 논현동 262-32, 서울, 강남구, 논현2동, 135832, 127.03777293805764, 37.51097430026847
31,21세기연세단과전문학원, 서울 노원구 동일로 1596, 송현빌딩, 서울 노원구 상계동 966-1, 서울, 노원구, , 139836, 127.05684204291343, 37.67097925489388
32,21세기연세보습학원, 서울 강북구 도봉로 189, 동고빌딩, 서울 강북구 미아동 304-38, 서울, 강북구, , 142812, 127.02601353971494, 37.62561295452065
33,21세기제1연세학원, 서울 강북구 도봉로 168, 우성빌딩, 서울 강북구 미아동 126-23, 서울, 강북구, 송중동, 142808, 127.02749005591424, 37.6238466852194
34,21세기제2연세학원, 서울 강북구 도봉로 168, 우성빌딩, 서울 강북구 미아동 126-23, 서울, 강북구, 송중동, 142808, 127.02749005591424, 37.6238466852194
35,21세기중앙보습학원, 서울 광진구 영화사로 34, , 서울 광진구 중곡동 89-8, 서울, 광진구, 중곡4동, 143888, 127.09054005151773, 37.5565831260707
36,238영어학원, 서울 송파구 올림픽로 145, 리센츠, 서울 송파구 잠실동 22-6, 서울, 송파구, 잠실2동, 138911, 127.08704314734736, 37.51197901749544
37,2C나라수학학원, 서울 중랑구 신내로14길 10, , 서울 중랑구 신내동 565-1, 서울, 중랑구, 신내1동, 131866, 127.09612584485369, 37.60548463250446
38,2관김영식영어학원, 서울 양천구 목동서로 349, 센트럴프라자, 서울 양천구 신정동 321-6, 서울, 양천구, 신정6동, 158885, 126.86530616446005, 37.51740518361339
39,2관세이브학원, 서울 마포구 백범로 108, , 서울 마포구 대흥동 202-13, 서울, 마포구, 대흥동, 121809, 126.94317067951394, 37.54710043617028
40,2관피큐브학원, 서울 양천구 신목로 53, , 서울 양천구 신정동 88-5, 서울, 양천구, 신정2동, 158849, 126.8724094881908, 37.52026744690458
41,2호선보습학원, 서울 강동구 양재대로 1335, , 서울 강동구 성내동 429-3, 서울, 강동구, 성내3동, 134890, 127.13490311015218, 37.52557883662603
42,300본관학원, 서울 송파구 삼전로8길 9, 미래빌딩, 서울 송파구 삼전동 6-9, 서울, 송파구, 삼전동, 138837, 127.09007080400367, 37.5051939855493
43,300에듀학원, 서울 도봉구 도봉로 566, , 서울 도봉구 창동 715-34, 서울, 도봉구, 창5동, 132926, 127.03911519225338, 37.65534903771295
44,3030영어수학학원, 서울 영등포구 여의대방로43라길 6, 신길프라자, 서울 영등포구 신길동 459-5, 서울, 영등포구, 신길1동, 150853, 126.92003738012255, 37.50774930234285
45,3030영어학원, 서울 용산구 새창로 70, 도원동삼성래미안, 서울 용산구 도원동 23, 서울, 용산구, 용문동, 140748, 126.95494450862392, 37.53860368432716
46,37도씨강북학원, 서울 도봉구 노해로69길 26, 창동시티월드, 서울 도봉구 창동 14, 서울, 도봉구, 창4동, 132899, 127.0509360955336, 37.65367951038159
47,37도씨동대문학원, 서울 동대문구 한천로 193, 동서울농협 장안동지점, 서울 동대문구 장안동 111-1, 서울, 동대문구, 장안2동, 130836, 127.06788388115741, 37.57816455772015
48,3관투탑학원, 서울 서대문구 거북골로 61, , 서울 서대문구 남가좌동 344-36, 서울, 서대문구, 남가좌2동, 120807, 126.92168322772494, 37.57784815529954
49,3관피큐브학원, 서울 양천구 신목로 38, 엘도라도빌딩, 서울 양천구 신정동 128-6, 서울, 양천구, 신정2동, 158849, 126.87362422472624, 37.51902897338572
50,4관피큐브학원, 서울 양천구 신목로 38, 엘도라도빌딩, 서울 양천구 신정동 128-6, 서울, 양천구, 신정2동, 158849, 126.87362422472624, 37.51902897338572
51,4플러스1시스템보습학원, 서울 강동구 고덕로 256, 명성프라자, 서울 강동구 명일동 46-1, 서울, 강동구, 명일2동, 134825, 127.15410414329948, 37.55461797224731
52,4플러스1학원, 서울 강동구 동남로71길 32, 환타지아, 서울 강동구 명일동 48-13, 서울, 강동구, 명일2동, 134825, 127.15450164040628, 37.55200456112919
53,5차원LINK수학학원, 서울 도봉구 도당로13라길 38, , 서울 도봉구 방학동 639-1, 서울, 도봉구, 방학2동, 132844, 127.03603869147649, 37.66762498788256
54,6관아이티씨고등전문영어학원, 서울 양천구 목동서로 349, 센트럴프라자, 서울 양천구 신정동 321-6, 서울, 양천구, 신정6동, 158885, 126.86530616446005, 37.51740518361339
55,A+한가람학원, 서울 성북구 월계로40길 7, 센트럴타운, 서울 성북구 장위동 316-3, 서울, 성북구, 장위3동, 136140, 127.04839586933926, 37.62294618361188
56,AwesomeEnglish학원, 서울 노원구 공릉로38길 23-6, 광우수산, 서울 노원구 공릉동 238-13, 서울, 노원구, 공릉2동, 139800, 127.08084306016679, 37.623436571462555
57,A플러스영수전문학원, 서울 동대문구 한천로46길 56-4, , 서울 동대문구 장안동 93-86, 서울, 동대문구, 장안2동, 130835, 127.07138754424385, 37.581600682989645
58,B.K.영어전문학원, 서울 종로구 평창12길 3, 나라빌딩, 서울 종로구 평창동 182-11, 서울, 종로구, 평창동, 110847, 126.96722539941635, 37.60617875339529
59,BLS에듀센터영어(Edu Center English)학원, 서울 광진구 광나루로 607, , 서울 광진구 광장동 530-13, 서울, 광진구, , , 127.09574990782757, 37.54186391231625
60,BMA(비엠에이)유명제5학원, 서울 도봉구 덕릉로63가길 30, , 서울 도봉구 창동 609-156, 서울, 도봉구, 창2동, 132919, 127.03874638878946, 37.64348501251294
61,BMA유명제1학원, 서울 도봉구 덕릉로63가길 42, , 서울 도봉구 창동 593-12, 서울, 도봉구, 창2동, 132919, 127.0380709646041, 37.64325818440023
62,BMA유명제3학원, 서울 도봉구 도봉로110아길 57-2, , 서울 도봉구 창동 609-44, 서울, 도봉구, 창2동, 132919, 127.03820254031812, 37.64353204104467
63,BMA유명학원, 서울 도봉구 도봉로110라길 69-32, , 서울 도봉구 창동 593-11, 서울, 도봉구, 창2동, 132919, 127.03794417140301, 37.64347446144097
64,BMH보습학원, 서울 강동구 올림픽로 820, 서연빌딩, 서울 강동구 암사동 462-3, 서울, 강동구, 암사1동, 134857, 127.12920988293753, 37.55407120064912
65,CMS중계중등영재2관학원, 서울 노원구 중계로 217, 중계중흥빌딩, 서울 노원구 중계동 360-6, 서울, 노원구, 중계1동, 139860, 127.07599520805334, 37.65050177762711
66,CMS중계중등영재학원, 서울 노원구 중계로 225, 청구3차아파트, 서울 노원구 중계동 360-2, 서울, 노원구, 중계1동, 139924, 127.07498429770966, 37.650383494769486
67,CMS학원, 서울 노원구 중계로 225, 청구3차아파트, 서울 노원구 중계동 360-2, 서울, 노원구, 중계1동, 139924, 127.07498429770966, 37.650383494769486
68,CNI수학원, 서울 성북구 아리랑로5길 26, 경향빌딩, 서울 성북구 동소문동7가 88, 서울, 성북구, 동선동, 136037, 127.0138329225037, 37.59689508265557
69,CnT영재교육학원, 서울 노원구 동일로193길 19, 청구빌딩, 서울 노원구 공릉동 383-2, 서울, 노원구, 공릉1동, 139801, 127.07159745068164, 37.62580312917841
70,CRI창의학원, 서울 노원구 동일로203가길 29, 브라운스톤중계, 서울 노원구 중계동 506, 서울, 노원구, 중계2.3동, 139880, 127.06428262742676, 37.639877132889374
71,D.S브릿지보습학원, 서울 도봉구 시루봉로 225, , 서울 도봉구 방학동 602-17, 서울, 도봉구, 방학2동, 132838, 127.03486487811247, 37.668533528890364
72,DCTENGLISH학원, 서울 성북구 동소문로 75, , 서울 성북구 동소문동6가 5-1, 서울, 성북구, 동선동, 136036, 127.0136871485569, 37.59235410176436
73,E&M학원, 서울 중랑구 면목로57길 33, , 서울 중랑구 면목동 552-4, 서울, 중랑구, 면목본동, 131818, 127.08652997492659, 37.584711594587
74,e-해법학원, 서울 노원구 한글비석로 474, 보람아파트2단지, 서울 노원구 상계동 639-1, 서울, 노원구, 상계9동, 139768, 127.06544205996913, 37.66482290345511
75,E.EDU[이.에듀]학원, 서울 강북구 인수봉로 288, , 서울 강북구 수유동 550-7, 서울, 강북구, 인수동, 142887, 127.01102262053757, 37.64440625999621
76,E.S학원, 서울 강북구 삼양로 446, , 서울 강북구 수유동 334-33, 서울, 강북구, 수유2동, 142877, 127.01645660915443, 37.64317308088306
77,ebest도원학원, 서울 용산구 새창로 70, 도원동삼성래미안, 서울 용산구 도원동 23, 서울, 용산구, 용문동, 140748, 126.95494450862392, 37.53860368432716
78,EBS스스로배움터학원, 서울 서대문구 거북골로 8-18, , 서울 서대문구 홍은동 400-44, 서울, 서대문구, 홍은2동, , 126.92557819372009, 37.58175738385943
79,edu-pro보습학원, 서울 노원구 동일로192길 77, 동신아파트, 서울 노원구 공릉동 745, 서울, 노원구, 공릉2동, 139728, 127.07690061455297, 37.627417964017795
80,EiE강동천동캠퍼스학원, 서울 강동구 성안로 158-1, , 서울 강동구 길동 416-5, 서울, 강동구, 길동, 134814, 127.13551237600188, 37.537186631766446
81,ELI학원, 서울 성북구 아리랑로5길 24, , 서울 성북구 동소문동7가 84-1, 서울, 성북구, 동선동, 136037, 127.01402314968489, 37.59684460469474
82,EMS보습학원, 서울 강동구 고덕로 256, 명성프라자, 서울 강동구 명일동 46-1, 서울, 강동구, 명일2동, 134825, 127.15410414329948, 37.55461797224731
83,EM수학학원, 서울 노원구 광운로2나길 11, 영광상가, 서울 노원구 월계동 475-35, 서울, 노원구, 월계1동, 139846, 127.06010372202945, 37.61692941139321
84,EM에듀보습학원, 서울 강동구 상암로3길 46, , 서울 강동구 암사동 503-1, 서울, 강동구, 암사2동, 134877, 127.12740998497429, 37.552462173232946
85,EM영수전문학원, 서울 도봉구 방학로 31-16, 신일빌딩, 서울 도봉구 방학동 724-37, 서울, 도봉구, 방학1동, 132854, 127.04860245718324, 37.66186141058388
86,EM플러스학원, 서울 중구 다산로40길 56, , 서울 중구 신당동 52-13, 서울, 중구, 동화동, 100831, 127.01907394704072, 37.56318636939371
87,EnA영재학원, 서울 노원구 초안산로5길 12, 월계프라자, 서울 노원구 월계동 776, 서울, 노원구, 월계2동, 139851, 127.05174642968466, 37.6325600896335
88,EnglishExpert영어전문학원, 서울 도봉구 방학로 184, , 서울 도봉구 방학동 668-8, 서울, 도봉구, 방학2동, 132848, 127.03174302807278, 37.6624293646746
89,English무무중계학원, 서울 노원구 한글비석로 363, 종로약국, 서울 노원구 중계동 450, 서울, 노원구, 중계4동, 139859, 127.07443886822215, 37.65795569578339
90,EPIC영어전문학원, 서울 노원구 수락산로 232, 미네르바빌딩, 서울 노원구 상계동 936-2, 서울, 노원구, 상계1동, 139836, 127.05296558472995, 37.671067553410985
91,ESK영어학원, 서울 도봉구 우이천로4라길 39, , 서울 도봉구 창동 504-17, 서울, 도봉구, 창3동, 132916, 127.04241121572488, 37.63238001336133
92,ESL영어스터디학원, 서울 성북구 오패산로3길 17, 동신아파트, 서울 성북구 하월곡동 219, 서울, 성북구, 월곡1동, 136776, 127.03454509969629, 37.60459250609914
93,ES보습학원, 서울 성북구 화랑로48길 16, 두산아파트, 서울 성북구 석관동 10, 서울, 성북구, 석관동, 136761, 127.06899447971388, 37.613763881176894
94,ETI개념원리자기주도학습학원, 서울 중랑구 양원역로 37, 경남아파트, 서울 중랑구 망우동 226, 서울, 중랑구, 망우본동, 131761, 127.10707237082846, 37.603813783888945
95,EWI(이더블유아이)보습학원, 서울 중랑구 겸재로29길 32, , 서울 중랑구 면목동 128-69, 서울, 중랑구, 면목본동, 131816, 127.08529414424484, 37.58912375367705
96,e브레인보습학원, 서울 노원구 중계로16가길 29, 에이스음악학원, 서울 노원구 중계동 93-31, 서울, 노원구, 중계본동, 139855, 127.08261287263342, 37.65043606215157
97,e해법수학건영2차점학원, 서울 중랑구 봉화산로56길 153, 대명프라자, 서울 중랑구 신내동 502-5, 서울, 중랑구, 신내1동, 131869, 127.09678656579841, 37.601483697062434
98,e해법수학이시습보습학원, 서울 성동구 상원길 60, , 서울 성동구 성수동1가 13-443, 서울, 성동구, 성수1가2동, 133822, 127.04811739495652, 37.54935680426374
99,e해법수학주니어랩영어학원, 서울 노원구 마들로 31, 그랑빌아파트, 서울 노원구 월계동 18, 서울, 노원구, 월계3동, 139956, 127.06708254838986, 37.61872402245875
100,Feelplus학원, 서울 노원구 섬밭로 196, 장미아파트, 서울 노원구 하계동 273, 서울, 노원구, 하계2동, 139736, 127.06727754387668, 37.633997436854735
101,F스터디보습학원, 서울 강동구 상암로3길 18, , 서울 강동구 암사동 502, 서울, 강동구, 암사2동, 134877, 127.12701869730313, 37.551291297903916
102,G1230풍납보습학원, 서울 송파구 토성로 36, , 서울 송파구 풍납동 257-91, 서울, 송파구, 풍납2동, 138874, 127.1142118541824, 37.529954297185625
103,G21학원, 서울 동대문구 고산자로31길 25, , 서울 동대문구 용두동 792-2, 서울, 동대문구, 용신동, 130070, 127.03661972186231, 37.576704369674374
104,GGE영어전문한솔플러스수학학원, 서울 노원구 한글비석로 332, 주공2단지아파트, 서울 노원구 중계동 369-7, 서울, 노원구, 중계4동, 139859, 127.07799196952807, 37.65710647722804
105,GGE영어해법수학학원, 서울 도봉구 해등로26길 7, , 서울 도봉구 쌍문동 215-1, 서울, 도봉구, 쌍문4동, 132872, 127.0326071651841, 37.65843597878483
106,GMA개념원리수학가락보습학원, 서울 송파구 동남로18길 20, , 서울 송파구 가락동 194-6, 서울, 송파구, 가락2동, 138812, 127.1323411255116, 37.49439618578909
107,GMstudy학원, 서울 광진구 아차산로 494, , 서울 광진구 광장동 471-6, 서울, 광진구, 광장동, 143814, 127.09668589039474, 37.54114955811379
108,GnB뉴보습학원, 서울 중구 다산로36가길 16, , 서울 중구 신당동 62-95, 서울, 중구, 동화동, 100816, 127.01947181535634, 37.561099596302455
109,GnB영어수유보습학원, 서울 강북구 노해로7길 34, , 서울 강북구 수유동 9-24, 서울, 강북구, 수유3동, 142872, 127.02081970476887, 37.63792866119941
110,GnB영어월곡학원, 서울 강북구 월계로 43-1, 성림빌딩, 서울 강북구 미아동 49-67, 서울, 강북구, 송중동, 142804, 127.03446676915321, 37.61154456437685
111,GnB영어전문학원, 서울 용산구 두텁바위로 51, , 서울 용산구 후암동 195-6, 서울, 용산구, 후암동, 140901, 126.97780271217235, 37.54601280622849
112,GnB영어학원, 서울 강북구 삼양로19길 25, 삼성래미안트리베라1차아파트, 서울 강북구 미아동 813, 서울, 강북구, 삼각산동, 142730, 127.02113970644649, 37.61569585628771
113,GnB영어해법수학학원, 서울 도봉구 도봉로180나길 41, 도봉한신아파트, 서울 도봉구 도봉동 30-1, 서울, 도봉구, 도봉2동, 132731, 127.04989592558962, 37.68434571615608
114,GoodNews보습학원, 서울 도봉구 해등로16길 46, , 서울 도봉구 창동 286-10, 서울, 도봉구, 창5동, 132906, 127.04241964457326, 37.65517490712958
115,GTM수학(고등)학원, 서울 노원구 동일로 1372, 동보빌딩, 서울 노원구 상계동 749-9, 서울, 노원구, 상계6.7동, 139832, 127.06179928542338, 37.65108669742344
116,HanMiller영어보습학원, 서울 광진구 자양로 282-1, 난빌딩, 서울 광진구 구의동 56-2, 서울, 광진구, 구의2동, 143818, 127.09172380513182, 37.55099602728859
117,HC최상철수학학원, 서울 도봉구 해등로 120, , 서울 도봉구 창동 296-37, 서울, 도봉구, 창5동, 132907, 127.04106827441434, 37.654191512555876
118,HIMS명성학원, 서울 노원구 석계로11길 4, , 서울 노원구 월계동 74, 서울, 노원구, 월계1동, 139841, 127.06357973290615, 37.618098874179324
119,Hi멘토수학학원, 서울 노원구 동일로191가길 42, 명일빌딩, 서울 노원구 공릉동 379-3, 서울, 노원구, 공릉1동, 139801, 127.07110461819084, 37.62692425453556
120,Hi멘토학원, 서울 노원구 동일로191가길 42, 명일빌딩, 서울 노원구 공릉동 379-3, 서울, 노원구, 공릉1동, 139801, 127.07110461819084, 37.62692425453556
121,I&B학원, 서울 노원구 동일로 1365, 랑은빌딩, 서울 노원구 상계동 746-3, 서울, 노원구, 상계6.7동, 139831, 127.06123230346893, 37.65061127410105
122,I&U학원, 서울 노원구 한글비석로46가길 38, 창우빌딩, 서울 노원구 상계동 459-7, 서울, 노원구, 상계5동, 139820, 127.06690269941545, 37.66574829217645
123,I-PMP학원, 서울 노원구 공릉로 152-5, , 서울 노원구 공릉동 237-8, 서울, 노원구, 공릉2동, 139800, 127.07980565399532, 37.62362828688917
124,IL영어n수학보습학원, 서울 강동구 천호대로193길 36, , 서울 강동구 길동 146, 서울, 강동구, 길동, 134809, 127.14516499197418, 37.536685016907235
125,IS학원, 서울 종로구 혜화로 13, 주호빌딩, 서울 종로구 명륜1가 46-3, 서울, 종로구, 혜화동, 110521, 126.99992753878162, 37.58669666286085
126,i에듀보습학원, 서울 송파구 올림픽로4길 42, 우성아파트, 서울 송파구 잠실동 101-1, 서울, 송파구, 잠실7동, 138798, 127.07202798577856, 37.5083238420701
127,JC영어보습학원, 서울 강동구 구천면로 510, , 서울 강동구 명일동 65, 서울, 강동구, 명일2동, 134826, 127.15497979702708, 37.54900901865674
128,JenisEnglishClub보습학원, 서울 도봉구 시루봉로 64, , 서울 도봉구 쌍문동 261, 서울, 도봉구, 쌍문4동, 132873, 127.02810951317302, 37.656480203375125
129,Jh안정희영어학원, 서울 노원구 동일로 1053, 영진빌딩, 서울 노원구 공릉동 494-15, 서울, 노원구, 공릉1동, 139806, 127.07319522352574, 37.62402900680047
130,Jinny's영,수전문학원, 서울 노원구 한글비석로49길 31, , 서울 노원구 상계동 456-46, 서울, 노원구, 상계5동, 139820, 127.06655553122081, 37.662822102838554
131,JK정석학원, 서울 성북구 아리랑로 117, 형제빌딩, 서울 성북구 정릉동 107-33, 서울, 성북구, 정릉2동, 136843, 127.01329939685355, 37.60222540607874
133,JND보습학원, 서울 강동구 상암로 29, 암사동대림빌딩, 서울 강동구 암사동 502-6, 서울, 강동구, 암사2동, 134877, 127.12695862792793, 37.55057056429765
134,JoyEnM보습학원, 서울 강동구 양재대로 1708, 아남아파트, 서울 강동구 고덕동 486, 서울, 강동구, 고덕1동, 134752, 127.1450662495746, 37.55813249760134
135,JS영어수학학원, 서울 도봉구 노해로63가길 42, , 서울 도봉구 창동 254-3, 서울, 도봉구, 창5동, 132906, 127.04539283669659, 37.65444580676854
136,J영어학원, 서울 노원구 동일로 1393, 일신프라자, 서울 노원구 상계동 730-5, 서울, 노원구, 상계6.7동, 139942, 127.06054976157426, 37.65294697374516
137,KEY학원, 서울 노원구 상계로 77, 다나플라자, 서울 노원구 상계동 337, 서울, 노원구, 상계2동, 139816, 127.0635129439807, 37.65674395694056
138,KM아카데미학원, 서울 동대문구 사가정로 148, 전농 SK아파트, 서울 동대문구 전농동 10, 서울, 동대문구, 전농2동, 130769, 127.06156565022646, 37.57665795576192
139,KOKOS영어학원, 서울 노원구 중계로 225, 청구3차아파트, 서울 노원구 중계동 360-2, 서울, 노원구, 중계1동, 139924, 127.07498429770966, 37.650383494769486
140,K수학학원, 서울 동대문구 전농로 104, , 서울 동대문구 답십리동 94-8, 서울, 동대문구, 답십리2동, 130883, 127.05781444865377, 37.57428122712017
141,Lanie'sEnglish&Math학원, 서울 성동구 독서당로 200, , 서울 성동구 옥수동 263-1, 서울, 성동구, 옥수동, 133839, 127.01312593069592, 37.543022845316514
