1833,매쓰피아수학학원, 서울 광진구 광나루로 584, 동서울빌딩, 서울 광진구 구의동 202-4, 서울, 광진구, 구의3동, 143821, 127.09355170597189, 37.54305499335086
1834,매쓰피아수학학원, 서울 은평구 서오릉로 160, 마성빌딩, 서울 은평구 갈현동 468-3, 서울, 은평구, 갈현2동, 122813, 126.91563486935055, 37.612683519297526
1835,매쓰피아초중고수학전문학원, 서울 마포구 성미산로 12, , 서울 마포구 성산동 293-2, 서울, 마포구, 성산1동, 121848, 126.90954856295015, 37.55817615678841
1836,매쓰피아학원, 서울 송파구 마천로8길 5, 진성빌딩, 서울 송파구 오금동 42-9, 서울, 송파구, 오금동, 138856, 127.12765440103735, 37.50730374046064
1837,매쓰홀릭(Matholic)보습학원, 서울 성북구 보문로 167, 광남 제니텔, 서울 성북구 삼선동5가 298-10, 서울, 성북구, 삼선동, 136045, 127.01607332527004, 37.589121040797735
1838,매쓰홀릭2학원, 서울 중랑구 신내로 50-3, 선일빌딩, 서울 중랑구 신내동 544, 서울, 중랑구, 신내1동, 131866, 127.09597862187961, 37.6037224162819
1839,매쓰홀릭수학학원, 서울 강동구 상암로61길 42, , 서울 강동구 명일동 246-6, 서울, 강동구, 명일2동, 134827, 127.15277896253724, 37.54855057586668
1840,매쓰홀릭학원, 서울 서초구 사평대로28길 22, , 서울 서초구 반포동 536-2, 서울, 서초구, 반포4동, 137807, 126.99997738222392, 37.4995087400394
1841,매씨스트보습학원, 서울 송파구 석촌호수로 110, , 서울 송파구 잠실동 242-5, 서울, 송파구, 잠실본동, 138864, 127.08906934723399, 37.50759141784376
1842,매일세시간수학도서광학원, 서울 양천구 목동동로 391, 현대파크빌, 서울 양천구 목동 907-23, 서울, 양천구, 목5동, 158727, 126.8802712827749, 37.53587381291355
1843,매일학원, 서울 성북구 화랑로 305, , 서울 성북구 장위동 3-14, 서울, 성북구, 장위3동, 136826, 127.06208565052722, 37.613922688229636
1844,매직스쿨학원, 서울 강서구 강서로18나길 1, , 서울 강서구 화곡동 339-15, 서울, 강서구, 화곡8동, 157879, 126.8472322448109, 37.53418506284997
1845,맥(MaC)잉글리시학원, 서울 성북구 종암로27길 26, 아이파크 종암동, 서울 성북구 종암동 130-2, 서울, 성북구, 종암동, 136090, 127.03089776032337, 37.60275189330557
1846,맥보습학원, 서울 서대문구 세무서길 83, , 서울 서대문구 홍제동 266-20, 서울, 서대문구, 홍제3동, 120857, 126.94692326498021, 37.591517652983796
1847,맥보습학원, 서울 용산구 이촌로 200, LG프라자, 서울 용산구 이촌동 302-52, 서울, 용산구, 이촌1동, 140854, 126.96934414520238, 37.5209522741971
1848,맥수학학원, 서울 구로구 개봉로 121, , 서울 구로구 개봉동 353-15, 서울, 구로구, 개봉1동, 152815, 126.85617454735397, 37.4966569019536
1849,맥스과학학원, 서울 강남구 삼성로71길 19, , 서울 강남구 대치동 914-1, 서울, 강남구, 대치4동, 135843, 127.05736496894251, 37.50181940720751
1850,맥스윈학원, 서울 노원구 노원로34길 76, 섬기는교회, 서울 노원구 상계동 430-13, 서울, 노원구, 상계5동, 139820, 127.06609275887281, 37.66241511959113
1851,맥스터디학원, 서울 관악구 봉천로13길 26, , 서울 관악구 봉천동 671-4, 서울, 관악구, 보라매동, 151821, 126.93072179011399, 37.48967826441481
1852,맥스터디학원, 서울 은평구 통일로69길 16, , 서울 은평구 대조동 80-2, 서울, 은평구, 대조동, 122947, 126.92687167035147, 37.61124583139176
1853,맥스프렙학원, 서울 강남구 테헤란로7길 12, , 서울 강남구 역삼동 648, 서울, 강남구, 역삼1동, 135911, 127.03098656266421, 37.50001644760985
1854,맥스학원, 서울 동작구 대방동23길 45, , 서울 동작구 대방동 388-17, 서울, 동작구, 대방동, 156810, 126.92279190243303, 37.50396330977389
1855,맥킨지킹잉글리쉬학원, 서울 강서구 곰달래로 177, , 서울 강서구 화곡동 872-17, 서울, 강서구, 화곡2동, 157904, 126.85268257914653, 37.5311430024154
1856,맥학원, 서울 구로구 구로중앙로28길 73, 구로하우비, 서울 구로구 구로동 110-5, 서울, 구로구, 구로5동, 152844, 126.88932021559943, 37.50084804451172
1857,맨캔보습학원, 서울 강동구 성내로15길 12, , 서울 강동구 성내동 544-17, 서울, 강동구, 성내1동, 134850, 127.12863997553995, 37.52800411237223
1858,맨투맨보습학원, 서울 광진구 면목로 119, , 서울 광진구 중곡동 231-38, 서울, 광진구, 중곡1동, 143903, 127.0801225095052, 37.56418785877882
1859,맨투맨영어수학학원, 서울 강북구 도봉로 167, , 서울 강북구 미아동 310-4, 서울, 강북구, 송천동, 142814, 127.02683750676157, 37.62364141036432
1860,맨투맨학원, 서울 동대문구 답십리로69길 45, , 서울 동대문구 장안동 324-11, 서울, 동대문구, 장안2동, 130839, 127.07386655615187, 37.5743695818877
1861,맨투스명성학원, 서울 서초구 고무래로 90-7, 서초쇼핑, 서울 서초구 서초동 1684-1, 서울, 서초구, 서초4동, 137882, 127.0174519721298, 37.499921913774685
1862,맨해튼랩영어학원, 서울 서초구 신반포로 38, 구반포상가, 서울 서초구 반포동 1048, 서울, 서초구, 반포본동, 137811, 126.98886270845139, 37.50151926053234
1863,맵스터디2관학원, 서울 양천구 중앙로32길 67, 태화상가빌라트, 서울 양천구 신정동 1021-7, 서울, 양천구, 신정1동, 158861, 126.8609658859624, 37.52046716696295
1864,맵플러스수학보습학원, 서울 동작구 만양로 16, , 서울 동작구 상도동 20-14, 서울, 동작구, 상도2동, 156831, 126.94744526663942, 37.506063578685314
1865,맵핑단과전문학원, 서울 은평구 진관2로 29-21, 드림스퀘어, 서울 은평구 진관동 72, 서울, 은평구, 진관동, 122200, 126.91934301046679, 37.63574056455872
1866,머쓰아인스학원, 서울 동대문구 고산자로 534, 한신아파트, 서울 동대문구 제기동 1212, 서울, 동대문구, 제기동, 130772, 127.03922052468464, 37.58839482516837
1867,멀티클래스학원, 서울 양천구 오목로13길 36, , 서울 양천구 신월동 466-1, 서울, 양천구, 신월2동, 158837, 126.84499536574037, 37.526022686035944
1868,멀티탑보습학원, 서울 강서구 가로공원로82길 43, , 서울 강서구 화곡동 369-10, 서울, 강서구, 화곡1동, 157884, 126.8405721481547, 37.535534967395755
1869,메가멘토스학원, 서울 은평구 연서로21길 3, , 서울 은평구 갈현동 463-18, 서울, 은평구, 갈현2동, 122813, 126.91723240584065, 37.61421272709535
1870,메가보습학원, 서울 서초구 신반포로 165, 반포쇼핑타운, 서울 서초구 잠원동 75-13, 서울, 서초구, 반포3동, 137909, 127.0021714865483, 37.50572565958964
1871,메가스토리매쓰선진수학교육학원, 서울 은평구 은평로 200, , 서울 은평구 응암동 72-2, 서울, 은평구, 응암1동, 122906, 126.92971262748326, 37.60113845314958
1872,메가아카데미학원, 서울 강서구 강서로 308, 신양빌딩, 서울 강서구 내발산동 677-9, 서울, 강서구, 우장산동, 157280, 126.83680006173184, 37.55313532344341
1873,메가에듀학원, 서울 노원구 덕릉로 787, 성신빌딩, 서울 노원구 상계동 101-181, 서울, 노원구, 상계3.4동, 139810, 127.07869648563512, 37.66748170737506
1874,메가에듀학원, 서울 은평구 갈현로33길 24, 갈현동현대아파트, 서울 은평구 갈현동 537, 서울, 은평구, 갈현1동, 122817, 126.91397057473215, 37.62196970119123
1875,메가에스디(SD)학원, 서울 금천구 한내로 62, 한신아파트, 서울 금천구 독산동 1093-4, 서울, 금천구, 독산1동, 153753, 126.88887637752164, 37.455389920417026
1876,메가탑보습학원, 서울 관악구 조원로 160-1, , 서울 관악구 신림동 469-2, 서울, 관악구, 신사동, 151893, 126.92008786556453, 37.48584767327432
1877,메가테스학원, 서울 성북구 삼양로9길 4-27, , 서울 성북구 길음동 1170-8, 서울, 성북구, , , 127.02227058550363, 37.60977074553152
1878,메가펀잉글리쉬학원, 서울 은평구 은평로16길 4, , 서울 은평구 응암동 72-10, 서울, 은평구, 응암1동, 122906, 126.92980343477093, 37.60091145758875
1879,메가포스학원, 서울 성북구 삼양로 68, , 서울 성북구 길음동 1140, 서울, 성북구, 길음2동, 136809, 127.02320816728596, 37.609208347516244
1880,메가플러스(MEGA+)학원, 서울 영등포구 국제금융로 78, 홍우빌딩, 서울 영등포구 여의도동 43-3, 서울, 영등포구, 여의동, 150889, 126.93129928889725, 37.520871399932176
1881,메디치보습학원, 서울 서초구 잠원로 148, 잠원연합상가, 서울 서초구 잠원동 56-3, 서울, 서초구, 잠원동, 137907, 127.01006263555381, 37.51626339889676
1882,메르센수학학원, 서울 강동구 상암로3길 68, , 서울 강동구 암사동 504-27, 서울, 강동구, 암사2동, 134877, 127.12778275925035, 37.55338799577862
1883,메르센수학학원, 서울 양천구 목동로 171, , 서울 양천구 신정동 1006-3, 서울, 양천구, 신정4동, 158860, 126.86474285419426, 37.52366830808759
1884,메리트영어학원, 서울 양천구 목동동로 339, 목동트윈빌, 서울 양천구 목동 905-22, 서울, 양천구, 목5동, 158728, 126.87674275914806, 37.532176081261504
1885,메릭스삼성보습학원, 서울 강동구 구천면로 476, 고덕주공아파트, 서울 강동구 명일동 257, 서울, 강동구, 명일2동, 134827, 127.15110952022339, 37.54896718310746
1886,메릭스해법수학학원, 서울 도봉구 우이천로 220-1, , 서울 도봉구 창동 585-84, 서울, 도봉구, 창2동, 132918, 127.03458818452698, 37.638930927355254
1887,메씨(MESSI)학원, 서울 강서구 강서로45길 39, , 서울 강서구 화곡동 1008-13, 서울, 강서구, 화곡3동, 157918, 126.83397354926299, 37.54782270606032
1888,메이플립보습학원, 서울 강남구 압구정로79길 35, , 서울 강남구 청담동 123-44, 서울, 강남구, 청담동, 135955, 127.05007498178979, 37.525439837906944
1889,메카(MECA)수학영어학원, 서울 영등포구 여의대방로 55, 신길프라자, 서울 영등포구 신길동 4493, 서울, 영등포구, 신길6동, 150860, 126.91281621057702, 37.49675192613312
1890,메카수학전문학원, 서울 도봉구 도봉로 571, , 서울 도봉구 쌍문동 656, 서울, 도봉구, 쌍문2동, 132893, 127.03869850492799, 37.65601950593781
1891,메카수학학원, 서울 양천구 목동중앙북로 13, , 서울 양천구 목동 611-5, 서울, 양천구, 목3동, 158811, 126.86501904804108, 37.54868398646856
1892,메카영수보습학원, 서울 강동구 동남로81길 66, , 서울 강동구 고덕동 643, 서울, 강동구, 고덕1동, 134806, 127.15329914845826, 37.559423133846884
1893,메카학원, 서울 구로구 경인로 377, , 서울 구로구 고척동 72-6, 서울, 구로구, 고척1동, 152826, 126.86213611674405, 37.49679015030396
1894,메카학원, 서울 서초구 신반포로 50, 구반포상가, 서울 서초구 반포동 978, 서울, 서초구, 반포본동, 137811, 126.99014287382289, 37.50178607202607
1895,메타매스학원, 서울 동작구 상도로53길 65, 미성빌딩, 서울 동작구 상도동 427, 서울, 동작구, 상도1동, 156836, 126.95381691622113, 37.502934346977185
1896,메타센스학원, 서울 강남구 역삼로 519, , 서울 강남구 대치동 953-21, 서울, 강남구, 대치2동, 135847, 127.06006717229127, 37.50376423612677
1897,메타에스(S)코드학원, 서울 구로구 구일로10길 49, 다원그린빌, 서울 구로구 구로동 685-154, 서울, 구로구, 구로1동, 152868, 126.87444600670818, 37.4957442912888
1898,메타인지창의보습학원, 서울 강동구 명일로 214, , 서울 강동구 길동 125-5, 서울, 강동구, 길동, 134809, 127.14622607359279, 37.53773247142692
1899,메타인지학원, 서울 금천구 시흥대로41길 3, , 서울 금천구 시흥동 985-6, 서울, 금천구, 시흥1동, 153863, 126.90266615515807, 37.44760291190163
1900,메트로영어학원, 서울 관악구 남부순환로 1720, , 서울 관악구 봉천동 930-41, 서울, 관악구, 청룡동, 151844, 126.94094488401564, 37.48240727511496
1901,메티스보습학원, 서울 광진구 아차산로 453, 동서울빌딩, 서울 광진구 구의동 219-5, 서울, 광진구, 구의3동, 143822, 127.09239299401615, 37.53937982760662
1902,메티스수학학원, 서울 관악구 남부순환로 1783, , 서울 관악구 봉천동 884-27, 서울, 관악구, 중앙동, 151837, 126.94836659560562, 37.48204313999299
1904,멘사영재교육학원, 서울 양천구 목동중앙남로 57, , 서울 양천구 목동 724-8, 서울, 양천구, 목4동, 158814, 126.86604619447375, 37.538774169393946
1905,멘처스학원, 서울 노원구 중계로 206, 세일학원, 서울 노원구 중계동 366-5, 서울, 노원구, 중계본동, 139861, 127.0775276144847, 37.65084315400114
1906,멘코스터디학원, 서울 서초구 명달로20길 61, , 서울 서초구 서초동 1512-5, 서울, 서초구, 서초3동, 137871, 127.0075937391413, 37.48657003275381
1907,멘토-k(mento-k)수학학원, 서울 도봉구 노해로63가길 42, , 서울 도봉구 창동 254-3, 서울, 도봉구, 창5동, 132906, 127.04539283669659, 37.65444580676854
1908,멘토0816학원, 서울 강남구 개포로82길 13-9, 세종빌딩, 서울 강남구 개포동 186-4, 서울, 강남구, 개포2동, 135994, 127.06775305145437, 37.48865920828233
1909,멘토2관학원, 서울 서초구 신반포로 22, 구반포상가, 서울 서초구 반포동 1053, 서울, 서초구, 반포본동, 137811, 126.98713021214438, 37.501101017743274
1910,멘토과학전문학원, 서울 노원구 중계로 206, 세일학원, 서울 노원구 중계동 366-5, 서울, 노원구, 중계본동, 139861, 127.0775276144847, 37.65084315400114
1911,멘토라학원, 서울 양천구 목동서로 77, 현대월드타워, 서울 양천구 목동 907, 서울, 양천구, 목5동, 158735, 126.87799016265622, 37.53596157818753
1912,멘토리쉬학원, 서울 영등포구 선유로 63, EEU동신타워, 서울 영등포구 문래동6가 5, 서울, 영등포구, 문래동, 150096, 126.88904810723285, 37.519653547188916
1913,멘토링영어학원, 서울 성북구 장월로3길 1, 동아다누프라자, 서울 성북구 상월곡동 101-2, 서울, 성북구, 월곡2동, 136120, 127.04701347946829, 37.60787500867505
1914,멘토보습학원, 서울 광진구 자양로 170, , 서울 광진구 구의동 236-28, 서울, 광진구, 구의1동, 143824, 127.08461220379567, 37.54279864536159
1915,멘토보습학원, 서울 양천구 목동중앙본로1길 47, , 서울 양천구 목동 761-14, 서울, 양천구, 목4동, 158817, 126.86856527853573, 37.53725250852106
1916,멘토수학·논술학원, 서울 금천구 독산로 8, 백운타워, 서울 금천구 시흥동 935, 서울, 금천구, 시흥5동, 153860, 126.9040301669207, 37.44850864513263
1917,멘토수학교실학원, 서울 송파구 올림픽로 203, 잠실주공아파트, 서울 송파구 잠실동 27-6, 서울, 송파구, , 138916, 127.09332351565288, 37.51248599272827
1918,멘토수학영어학원, 서울 강북구 월계로37길 129, , 서울 강북구 번동 191, 서울, 강북구, 번3동, 142861, 127.04398998532444, 37.62770151516252
1919,멘토수학전문학원, 서울 노원구 한글비석로 273, 대웅빌딩, 서울 노원구 중계동 359-8, 서울, 노원구, 중계1동, 139860, 127.07722076317003, 37.652169601842445
1920,멘토수학전문학원, 서울 서초구 신반포로 22, 구반포상가, 서울 서초구 반포동 1053, 서울, 서초구, 반포본동, 137811, 126.98713021214438, 37.501101017743274
1921,멘토수학학원, 서울 서초구 방배중앙로 48, , 서울 서초구 방배동 931-26, 서울, 서초구, 방배1동, 137844, 126.99140698271, 37.484342671667434
1922,멘토스2학원, 서울 동작구 사당로23길 164, 열린공인중개사, 정치과, 서울 동작구 사당동 173-28, 서울, 동작구, 사당3동, 156818, 126.97154153667479, 37.489637484340044
1923,멘토스국어논술학원, 서울 서초구 서초대로 43, 아림빌딩, 서울 서초구 방배동 867-32, 서울, 서초구, 방배4동, 137838, 126.98708754088645, 37.48620195983735
1924,멘토스보습학원, 서울 구로구 중앙로14길 15, , 서울 구로구 고척동 180-3, 서울, 구로구, 고척2동, 152831, 126.8619637058439, 37.5069028308911
1925,멘토스테이블(Mentors'Table)학원, 서울 강남구 압구정로34길 34, 성우 에스, 서울 강남구 신사동 608-14, 서울, 강남구, 압구정동, 135894, 127.03048590047545, 37.52584295983594
1926,멘토스학원, 서울 강남구 삼성로64길 27, , 서울 강남구 대치동 975-16, 서울, 강남구, 대치2동, 135842, 127.0626248819824, 37.500450811051586
1927,멘토스학원, 서울 용산구 장문로 81, , 서울 용산구 보광동 217-13, 서울, 용산구, 보광동, 140823, 126.99863792497295, 37.52619647541905
1928,멘토아카데미학원, 서울 영등포구 국제금융로 78, 홍우빌딩, 서울 영등포구 여의도동 43-3, 서울, 영등포구, 여의동, 150889, 126.93129928889725, 37.520871399932176
1929,멘토엔멘티학원, 서울 강서구 곰달래로31길 3, 화창빌딩, 서울 강서구 화곡동 159-36, 서울, 강서구, 화곡8동, 157876, 126.85124355767704, 37.53110515857525
1930,멘토탑학원, 서울 양천구 신목로 36, 대보빌딩, 서울 양천구 신정동 128-105, 서울, 양천구, 신정2동, 158849, 126.87378289960131, 37.51884533851341
1931,멘토플러스학원, 서울 강남구 도산대로 517, 난지빌딩, 서울 강남구 청담동 124-8, 서울, 강남구, 청담동, 135957, 127.04985739713172, 37.5248704965754
1932,멘토학원, 서울 강남구 도곡로63길 34, 요안빌딩, 서울 강남구 대치동 924-1, 서울, 강남구, 대치4동, 135998, 127.05377122388228, 37.49912528788463
1933,멘토학원, 서울 강서구 강서로47길 165, 신원메디칼프라자, 서울 강서구 내발산동 750-11, 서울, 강서구, 발산1동, 157937, 126.8269219229208, 37.55343119985781
1934,멘토학원, 서울 동대문구 신이문로 37, , 서울 동대문구 이문동 220-111, 서울, 동대문구, 이문2동, 130828, 127.06624870325767, 37.603195047210136
1935,멜리사영어전문학원, 서울 성북구 정릉로 251, 명성빌딩, 서울 성북구 정릉동 161-17, 서울, 성북구, 정릉2동, 136845, 127.01191821629175, 37.60472309872349
1936,멤피스영어학원, 서울 양천구 신목로 38, 엘도라도빌딩, 서울 양천구 신정동 128-6, 서울, 양천구, 신정2동, 158849, 126.87362422472624, 37.51902897338572
1937,면목뉴스터디학원, 서울 중랑구 사가정로49길 63, , 서울 중랑구 면목동 566-10, 서울, 중랑구, 면목3.8동, 131831, 127.08680515854392, 37.58379237971253
1938,면일보습학원, 서울 중랑구 용마산로94길 47, 면일학원, 서울 중랑구 면목동 2-8, 서울, 중랑구, 면목3.8동, 131811, 127.0993649834619, 37.588615399573996
1939,명가은영어학원, 서울 은평구 갈현로 120, 크리스탈명과, 서울 은평구 구산동 24-44, 서울, 은평구, 구산동, 122820, 126.91108221653244, 37.60854283567863
1940,명륜학원, 서울 관악구 남부순환로 1534, , 서울 관악구 신림동 1576-16, 서울, 관악구, , 151899, 126.9210680353906, 37.482748863607355
1941,명륜학원, 서울 은평구 가좌로 312, , 서울 은평구 신사동 30-50, 서울, 은평구, 신사1동, 122882, 126.91045432828294, 37.595701448324355
1942,명문논리수학학원, 서울 강남구 삼성로4길 17, 주공아파트, 서울 강남구 개포동 187, 서울, 강남구, 개포2동, 135994, 127.06903687114679, 37.48791603468883
1943,명문대수학학원, 서울 송파구 오금로 210, 신화빌딩, 서울 송파구 송파동 147-2, 서울, 송파구, 송파2동, 138854, 127.11681955227398, 37.507423073049196
1944,명문보습학원, 서울 관악구 난향길 5, , 서울 관악구 신림동 667-78, 서울, 관악구, 난향동, 151884, 126.9185571308582, 37.462733924167146
1945,명문보습학원, 서울 도봉구 도당로 133, , 서울 도봉구 방학동 657-12, 서울, 도봉구, 방학1동, 132847, 127.04109824771473, 37.667450345245655
1946,명문수학학원, 서울 강서구 양천로 683, , 서울 강서구 염창동 249-10, 서울, 강서구, 염창동, 157861, 126.8722756954149, 37.55096617757244
1947,명문엔학원, 서울 금천구 문성로 49, 신건빌딩, 서울 금천구 독산동 894-15, 서울, 금천구, 독산3동, 153820, 126.90901332758007, 37.477045819159905
1948,명문연세학원, 서울 서대문구 가좌로 142, , 서울 서대문구 홍은동 343-1, 서울, 서대문구, 홍은2동, 120848, 126.92405814026824, 37.58470806943117
1949,명문이엠아이학원, 서울 강남구 선릉로68길 7, , 서울 강남구 대치동 921-16, 서울, 강남구, 대치4동, 135843, 127.05229651031982, 37.499064681509665
1950,명문지혜보습학원, 서울 강서구 양천로24길 54-31, , 서울 강서구 방화동 262-24, 서울, 강서구, 방화1동, 157847, 126.81361053320256, 37.57082177203135
1951,명문캠퍼스학원, 서울 은평구 은평로21길 57, 태훈빌딩, 서울 은평구 녹번동 83-31, 서울, 은평구, 녹번동, 122829, 126.9281933081762, 37.603083677653395
1952,명문학원, 서울 용산구 한강대로104라길 39, , 서울 용산구 후암동 117-1, 서울, 용산구, 후암동, 140900, 126.9759911519447, 37.54917675967127
1953,명문학원, 서울 은평구 진흥로 160, 진흥빌딩, 서울 은평구 녹번동 131-6, 서울, 은평구, 녹번동, 122832, 126.92743586245165, 37.60874142992253
1954,명석보습학원, 서울 성동구 왕십리로14길 32-3, 남광대중탕, 서울 성동구 성수동1가 656-895, 서울, 성동구, 성수1가2동, 133924, 127.04739709841618, 37.5484524930282
1955,명석학원, 서울 동대문구 제기로 42, , 서울 동대문구 제기동 705, 서울, 동대문구, 제기동, 130864, 127.03759816416013, 37.58639875324835
1956,명선학원, 서울 동대문구 황물로 42, , 서울 동대문구 답십리동 542-1, 서울, 동대문구, 답십리1동, 130806, 127.04620387856859, 37.57332768385892
1957,명성보습학원, 서울 동대문구 한천로 264, , 서울 동대문구 휘경동 57-1, 서울, 동대문구, 휘경2동, 130874, 127.06831515633137, 37.5843090848262
1958,명성수능영어학원, 서울 동작구 상도로 313, PRIMISE, 서울 동작구 상도1동 262, 서울, 동작구, 상도1동, 156031, 126.95064306800307, 37.500150757597076
1959,명성수학보습학원, 서울 송파구 마천로 106, 향기빌딩, 서울 송파구 오금동 32-3, 서울, 송파구, 오금동, 138855, 127.13132525496229, 37.50578963286745
1960,명성아카데미학원, 서울 강서구 곰달래로59길 67, 대림BD, 서울 강서구 화곡동 773-1, 서울, 강서구, 화곡4동, 157897, 126.86265793980888, 37.535400538197784
1961,명성영재사관학원, 서울 중랑구 동일로 492, 센타빌딩, 서울 중랑구 면목동 720-6, 서울, 중랑구, 면목4동, 131835, 127.08039148940162, 37.574343694968285
1962,명성학원, 서울 서초구 신반포로 22, 구반포상가, 서울 서초구 반포동 1053, 서울, 서초구, 반포본동, 137811, 126.98713021214438, 37.501101017743274
1963,명성학원, 서울 은평구 은평로 216, , 서울 은평구 응암동 64-3, 서울, 은평구, 응암1동, 122905, 126.93148392784124, 37.600934068900855
1964,명성휴브레인학원, 서울 양천구 은행정로 55, , 서울 양천구 신정동 954-13, 서울, 양천구, 신정4동, 158859, 126.85907123253838, 37.5246167385348
1966,명스터디학원, 서울 마포구 마포대로24길 51, 정원헵시바, 서울 마포구 아현동 395-1, 서울, 마포구, 공덕동, 121861, 126.96202991101147, 37.55182923873411
1967,명신학원, 서울 강서구 공항대로41길 66, 세신등촌종합상가, 서울 강서구 등촌동 698-1, 서울, 강서구, 등촌3동, 157930, 126.84658066988615, 37.56063031252511
1968,명인2관학원, 서울 노원구 한글비석로 235, 하나프라자빌딩, 서울 노원구 중계동 360-11, 서울, 노원구, 중계1동, 139860, 127.07634247684707, 37.6487932895981
1969,명인3관학원, 서울 강남구 도곡로 408, 디마크 빌딩, 서울 강남구 대치동 1024, 서울, 강남구, 대치1동, 135500, 127.05523500533056, 37.49662341893901
1970,명인더엠(TheM)수학전문학원, 서울 노원구 한글비석로 235, 하나프라자빌딩, 서울 노원구 중계동 360-11, 서울, 노원구, 중계1동, 139860, 127.07634247684707, 37.6487932895981
1971,명인보습학원, 서울 송파구 삼학사로13길 4, , 서울 송파구 삼전동 132-5, 서울, 송파구, 삼전동, 138840, 127.09658278966832, 37.50331114601085
1972,명인수학과학학원, 서울 송파구 석촌호수로 134, 왕국회관, 서울 송파구 삼전동 22, 서울, 송파구, 삼전동, 138837, 127.09192793325995, 37.50709547722016
1973,명인학원, 서울 노원구 한글비석로 235, 하나프라자빌딩, 서울 노원구 중계동 360-11, 서울, 노원구, 중계1동, 139860, 127.07634247684707, 37.6487932895981
1974,명인학원, 서울 양천구 목동동로 435, , 서울 양천구 목동 909-5, 서울, 양천구, 목5동, 158879, 126.88486712006767, 37.537384855041346
1975,명인학원, 서울 종로구 동숭길 127, 우성빌딩, 서울 종로구 동숭동 1-41, 서울, 종로구, 이화동, 110809, 127.00305681852929, 37.58329447326632
