5601,장안HB영수학원, 서울 동대문구 천호대로91길 83, , 서울 동대문구 장안동 359-6, 서울, 동대문구, 장안1동, 130841, 127.0704528641114, 37.56526440832809
5602,장안대치에스학원, 서울 동대문구 장한로 178, , 서울 동대문구 장안동 311-1, 서울, 동대문구, 장안2동, 130839, 127.07237404552929, 37.57618330711834
5603,장안드림러닝센터학원, 서울 동대문구 장한로18길 54-1, , 서울 동대문구 장안동 349-13, 서울, 동대문구, 장안1동, 130841, 127.07200354280732, 37.56761687375901
5604,장안로드맵수학학원, 서울 동대문구 한천로 124, 장안동 근린생활시설, 서울 동대문구 장안동 146-25, 서울, 동대문구, 장안1동, 130837, 127.06616679532985, 37.572078413944524
5605,장안이투스수학학원, 서울 동대문구 답십리로69길 45, , 서울 동대문구 장안동 324-11, 서울, 동대문구, 장안2동, 130839, 127.07386655615187, 37.5743695818877
5606,장안탑학원, 서울 동대문구 답십리로69길 8, 장안동 근린생활시설, 서울 동대문구 장안동 331-1, 서울, 동대문구, 장안2동, 130840, 127.07401887346198, 37.572715260246355
5607,장영길수학전문학원, 서울 양천구 목동서로 67, 우성에펠타운빌딩, 서울 양천구 목동 907-4, 서울, 양천구, 목5동, 158708, 126.87855064793938, 37.536398239962146
5608,장원보습학원, 서울 용산구 만리재로 134, 파리바게뜨제과, 서울 용산구 서계동 266-73, 서울, 용산구, 청파동, 140830, 126.96256883156207, 37.551346475778466
5609,장원수학학원, 서울 송파구 석촌호수로 140, 잠실레이크타워, 서울 송파구 삼전동 22-2, 서울, 송파구, 삼전동, 138837, 127.09250238432456, 37.50701574035338
5610,장윤선수학보습학원, 서울 강남구 도곡로70길 5, , 서울 강남구 대치동 1023-19, 서울, 강남구, 대치1동, 135500, 127.05662396296376, 37.49699397604059
5611,장학스카이보습학원, 서울 송파구 석촌호수로 140, 잠실레이크타워, 서울 송파구 삼전동 22-2, 서울, 송파구, 삼전동, 138837, 127.09250238432456, 37.50701574035338
5612,장학청림보습학원, 서울 영등포구 대림로 203, 송원빌딩, 서울 영등포구 대림동 740-2, 서울, 영등포구, , 150815, 126.89790886414004, 37.498797881961416
5613,장학학원, 서울 영등포구 대림로 203, 송원빌딩, 서울 영등포구 대림동 740-2, 서울, 영등포구, , 150815, 126.89790886414004, 37.498797881961416
5614,장한보습학원, 서울 서초구 사임당로 151, 대한무지개종합상가, 서울 서초구 서초동 1332-2, 서울, 서초구, 서초2동, 137859, 127.02569124412935, 37.492067234720295
5615,장현진수학보습학원, 서울 노원구 동일로 1554, 다래빌딩, 서울 노원구 상계동 649-1, 서울, 노원구, 상계9동, 139822, 127.05751015439421, 37.66720562622216
5618,장화영어학원, 서울 강동구 구천면로 660, , 서울 강동구 상일동 207, 서울, 강동구, 상일동, 134837, 127.17120227949304, 37.55070931929424
5619,재능스스로러닝센터강북수유학원, 서울 강북구 삼양로74길 81, , 서울 강북구 수유동 55-34, 서울, 강북구, 수유1동, 142874, 127.02242628178267, 37.63041054308237
5620,재능스스로러닝센터신정이펜학원, 서울 양천구 신정이펜2로 22, 신정프라자, 서울 양천구 신정동 1320-2, 서울, 양천구, 신정3동, 158070, 126.8325669619901, 37.51289433730376
5621,재능스스로러닝센터쌍문탑학원, 서울 도봉구 노해로46길 25, , 서울 도봉구 쌍문동 315-12, 서울, 도봉구, 쌍문3동, 132952, 127.02948484042491, 37.6495927560395
5622,재능스스로러닝센터중계학원, 서울 노원구 중계로 162-11, 현대프라자, 서울 노원구 중계동 84-7, 서울, 노원구, 중계본동, 139855, 127.08148808050571, 37.64980976035116
5623,재능스스로러닝센터증산교일학원, 서울 은평구 증산서길 63, , 서울 은평구 증산동 209-17, 서울, 은평구, 증산동, 122940, 126.90538458568341, 37.582478135882994
5624,재안학원, 서울 서대문구 세무서길 84, , 서울 서대문구 홍제동 268-6, 서울, 서대문구, 홍제3동, 120857, 126.94713621502108, 37.591402421569406
5625,재외국민특례학원, 서울 강남구 선릉로 427, , 서울 강남구 역삼동 708-37, 서울, 강남구, 역삼2동, 135919, 127.04931360885077, 37.503059222390355
5626,잭스학원, 서울 송파구 새말로12길 7, , 서울 송파구 문정동 98, 서울, 송파구, 장지동, 138200, 127.12931296317672, 37.48267563248725
5627,저스트영어학원, 서울 송파구 오금로46길 41, , 서울 송파구 가락동 189, 서울, 송파구, 가락2동, 138812, 127.1334488370483, 37.49412463780818
5628,적중수학학원, 서울 강동구 고덕로 101, 대암빌딩, 서울 강동구 암사동 451-12, 서울, 강동구, 암사3동, 134855, 127.1367305685317, 37.55494210433259
5629,적중코아스쿨학원, 서울 강남구 압구정로34길 26, , 서울 강남구 신사동 608-10, 서울, 강남구, 압구정동, 135894, 127.03054042846743, 37.52639796304061
5630,전농GnB영어학원, 서울 동대문구 사가정로 148, 전농 SK아파트, 서울 동대문구 전농동 10, 서울, 동대문구, 전농2동, 130769, 127.06156565022646, 37.57665795576192
5631,전문가그룹학원, 서울 강동구 양재대로 1607, 약봉빌딩, 서울 강동구 천호동 25-10, 서울, 강동구, 천호1동, 134861, 127.14341005537804, 37.549059677119516
5632,전문가수학학원, 서울 송파구 석촌호수로 80, 송천빌딩, 서울 송파구 잠실동 209, 서울, 송파구, 잠실본동, 138862, 127.08632500777107, 37.509114351011846
5633,전문가집단2관학원, 서울 양천구 목동동로 387, 광장2종합상가, 서울 양천구 목동 907-13, 서울, 양천구, 목5동, 158877, 126.87984618115681, 37.5356751611302
5634,전문가집단보습학원, 서울 광진구 용마산로 111, , 서울 광진구 중곡동 28-7, 서울, 광진구, 중곡3동, 143884, 127.08664136905705, 37.563595805388644
5635,전문가집단학원, 서울 노원구 중계로18길 17, 동진프라자, 서울 노원구 중계동 366-13, 서울, 노원구, 중계본동, 139861, 127.07787734478974, 37.6515240666277
5636,전문가집단학원, 서울 서대문구 가좌로 103, , 서울 서대문구 홍은동 400-10, 서울, 서대문구, 홍은2동, 120848, 126.92630269703214, 37.58181910595767
5637,전문가집단학원, 서울 양천구 목동동로 387, 광장2종합상가, 서울 양천구 목동 907-13, 서울, 양천구, 목5동, 158877, 126.87984618115681, 37.5356751611302
5638,전문가학원, 서울 동작구 대방동15가길 23, 한성빌딩, 서울 동작구 대방동 387-1, 서울, 동작구, 대방동, 156810, 126.92349315336003, 37.503906101686226
5639,전문가학원, 서울 송파구 석촌호수로 94, 서원빌딩, 서울 송파구 잠실동 209-9, 서울, 송파구, 잠실본동, 138862, 127.08748208298047, 37.50816924699792
5640,전문고대영어학원, 서울 구로구 고척로 196, , 서울 구로구 고척동 161-73, 서울, 구로구, 고척2동, 152829, 126.85510519153176, 37.50463129390844
5641,전문호영어학원, 서울 은평구 갈현로11길 21, , 서울 은평구 역촌동 74-28, 서울, 은평구, 역촌동, 122902, 126.90814204123943, 37.604947437682625
5642,전박사아카데미학원, 서울 강남구 역삼로 450, , 서울 강남구 대치동 911-8, 서울, 강남구, 대치4동, 135841, 127.05640624981127, 37.502223519431304
5643,전샘보습학원, 서울 성동구 동호로 88, 새한빌딩, 서울 성동구 금호동4가 1418-3, 서울, 성동구, 금호4가동, 133809, 127.01651700056347, 37.54736883984883
5644,전샘학원, 서울 중구 다산로 162, 약수빌딩, 서울 중구 신당동 340-73, 서울, 중구, 청구동, 100450, 127.01267583104301, 37.557896576120314
5645,전인학원, 서울 강서구 초록마을로4길 2, , 서울 강서구 화곡동 24-252, 서울, 강서구, 화곡본동, 157866, 126.845600127452, 37.544364232002366
5646,전진학원, 서울 성북구 보문로 183, 논현빌딩, 서울 성북구 삼선동4가 336, 서울, 성북구, 삼선동, 136044, 127.01478730588435, 37.59017717201092
5647,전형필국어학원, 서울 동작구 대방동길 83, 정일학원, 서울 동작구 대방동 381-48, 서울, 동작구, 대방동, 156810, 126.92434689276821, 37.505157246788194
5648,전회경영어학원, 서울 강남구 남부순환로 2911, 청우빌딩, 서울 강남구 대치동 653, 서울, 강남구, 대치1동, 135838, 127.05795484050373, 37.49243063213406
5649,점프수학보습학원, 서울 송파구 송이로 22-1, , 서울 송파구 송파동 174-3, 서울, 송파구, 송파2동, 138854, 127.11622450661913, 37.50295827999716
5650,점프스터디학원, 서울 양천구 목동중앙본로 106, , 서울 양천구 목동 531-18, 서울, 양천구, 목2동, 158809, 126.8711135690312, 37.54499670273443
5651,점프잉글리쉬플러스학원, 서울 영등포구 당산로44길 3, 삼성타운, 서울 영등포구 당산동5가 11-34, 서울, 영등포구, 당산2동, 150045, 126.90107685409343, 37.531914255198544
5652,점핑전뇌보습학원, 서울 도봉구 도봉로136길 7, 한독패밀리타운, 서울 도봉구 창동 749-16, 서울, 도봉구, 창5동, 132928, 127.04165135100392, 37.65931609418883
5653,정광학원, 서울 영등포구 도신로48길 9-2, 푸른학원, 서울 영등포구 신길동 158-41, 서울, 영등포구, 신길4동, 150840, 126.91326654869525, 37.51021327715389
5654,정교수학학원, 서울 도봉구 도봉로 527, , 서울 도봉구 쌍문동 81-50, 서울, 도봉구, 쌍문2동, 132863, 127.03657074167553, 37.652409046980054
5655,정교아이매쓰학원, 서울 도봉구 도봉로 569, 예일빌딩, 서울 도봉구 쌍문동 657, 서울, 도봉구, 쌍문2동, 132893, 127.03858511571151, 37.65589700950044
5656,정교학원, 서울 중랑구 상봉로 61, 한양빌딩, 서울 중랑구 면목동 87-65, 서울, 중랑구, 면목본동, 131817, 127.09324540473229, 37.5914603194154
5658,정구은수학학원, 서울 송파구 올림픽로 145, 리센츠, 서울 송파구 잠실동 22-6, 서울, 송파구, 잠실2동, 138911, 127.08704314734736, 37.51197901749544
5659,정근용영어보습학원, 서울 송파구 위례성대로22길 24, , 서울 송파구 오금동 22-3, 서울, 송파구, 오금동, 138855, 127.1302801893423, 37.50837126678243
5660,정대영대과영어전문학원, 서울 서초구 효령로 221, , 서울 서초구 서초동 1527-7, 서울, 서초구, 서초3동, 137871, 127.00832159209726, 37.48374081737606
5661,정도보습학원, 서울 강동구 명일로 244, , 서울 강동구 길동 99-3, 서울, 강동구, 길동, 134808, 127.14710030388736, 37.540412759828776
5662,정도보습학원, 서울 구로구 구로중앙로7길 28, 극동아파트, 서울 구로구 구로동 314, 서울, 구로구, 구로4동, 152850, 126.889614765239, 37.491279633311436
5663,정도학원, 서울 노원구 동일로 1624, 통일상가, 서울 노원구 상계동 1025-40, 서울, 노원구, 상계1동, 139837, 127.05585088980634, 37.673354710797966
5664,정릉대성학원, 서울 성북구 정릉로31나길 8, , 서울 성북구 정릉동 175-15, 서울, 성북구, 정릉1동, 136840, 127.01533365732524, 37.60414967466401
5665,정립에듀원학원, 서울 서초구 효령로14다길 6, , 서울 서초구 방배동 541-2, 서울, 서초구, 방배3동, 137824, 126.99062080819405, 37.47822295885121
5666,정명학원, 서울 구로구 경인로19길 29, , 서울 구로구 오류동 13-13, 서울, 구로구, 오류1동, 152890, 126.84234120471027, 37.49706092124232
5667,정명학원, 서울 서대문구 응암로 66, , 서울 서대문구 북가좌동 306-21, 서울, 서대문구, 북가좌2동, 120813, 126.9108005634631, 37.578842338956456
5668,정문보습학원, 서울 강서구 방화동로 113, , 서울 강서구 방화동 580-28, 서울, 강서구, 방화2동, 157851, 126.81240249469215, 37.57046306491244
5669,정상도전학원, 서울 노원구 한글비석로 273, 대웅빌딩, 서울 노원구 중계동 359-8, 서울, 노원구, 중계1동, 139860, 127.07722076317003, 37.652169601842445
5670,정상보습학원, 서울 중랑구 면목로48길 65, 경상빌딩, 서울 중랑구 면목동 449-23, 서울, 중랑구, 면목3.8동, 131813, 127.09227817231678, 37.582072737174904
5671,정상수학학원, 서울 동대문구 답십리로 311, , 서울 동대문구 장안동 331-5, 서울, 동대문구, 장안2동, 130840, 127.07521836650794, 37.57229644047602
5672,정상수학학원, 서울 양천구 목동서로 35, , 서울 양천구 목동 908-31, 서울, 양천구, 목5동, 158878, 126.88211048508784, 37.53763801927564
5673,정상에듀학원, 서울 중랑구 중랑역로 145, 꿈이있는교회, 서울 중랑구 묵동 249-111, 서울, 중랑구, 묵2동, 131853, 127.07660718131834, 37.60641071794577
5674,정상플러스잉글루영수학원, 서울 강동구 명일로 375, 삼익그린맨션, 서울 강동구 명일동 15, 서울, 강동구, 명일1동, 134824, 127.14945889228039, 37.552014655839486
5675,정상플러스학원, 서울 강서구 양천로67길 15, 한희빌딩, 서울 강서구 염창동 242-11, 서울, 강서구, 염창동, 157861, 126.86752000386845, 37.555047861739176
5676,정상학원, 서울 영등포구 가마산로61나길 13, 대림빌딩, 서울 영등포구 신길동 317-1, 서울, 영등포구, 신길3동, 150841, 126.90612695585408, 37.506924558578596
5677,정석사관학원, 서울 강서구 양천로14길 52, , 서울 강서구 방화동 553-30, 서울, 강서구, 방화2동, 157850, 126.80942642338736, 37.570966458879994
5678,정석수리언어학원, 서울 양천구 중앙로32길 67, 태화상가빌라트, 서울 양천구 신정동 1021-7, 서울, 양천구, 신정1동, 158861, 126.8609658859624, 37.52046716696295
5679,정석수리학원, 서울 강서구 강서로45길 46, 수경빌딩, 서울 강서구 내발산동 722-1, 서울, 강서구, 발산1동, 157835, 126.83361983699338, 37.54811413148309
5680,정석중등학원, 서울 서대문구 세검정로 90, 문화촌빌딩, 서울 서대문구 홍제동 279-28, 서울, 서대문구, 홍제3동, 120863, 126.94909449388622, 37.5955514483248
5681,정석초등학원, 서울 서대문구 세검정로 90, 문화촌빌딩, 서울 서대문구 홍제동 279-28, 서울, 서대문구, 홍제3동, 120863, 126.94909449388622, 37.5955514483248
5682,정석학원, 서울 강서구 곰달래로31길 15, 디헤리움, 서울 강서구 화곡동 159-5, 서울, 강서구, , , 126.85120199812782, 37.531523170472965
5683,정석학원, 서울 서대문구 세검정로 90, 문화촌빌딩, 서울 서대문구 홍제동 279-28, 서울, 서대문구, 홍제3동, 120863, 126.94909449388622, 37.5955514483248
5684,정석학원, 서울 성북구 장월로 121, , 서울 성북구 장위동 237-274, 서울, 성북구, 장위1동, 136833, 127.04887194897037, 37.61651653899958
5685,정선과학학원, 서울 양천구 목동서로 246, , 서울 양천구 목동 406-143, 서울, 양천구, 목1동, 158806, 126.8695312156723, 37.525749602707286
5686,정선생수학학원, 서울 송파구 가락로11길 33, 지선빌딩, 서울 송파구 석촌동 264-2, 서울, 송파구, 석촌동, 138846, 127.10348584038182, 37.50313591136775
5687,정선수학보습학원, 서울 송파구 올림픽로 145, 리센츠, 서울 송파구 잠실동 22-6, 서울, 송파구, 잠실2동, 138911, 127.08704314734736, 37.51197901749544
5688,정성학원, 서울 서초구 반포대로 304, 금정빌딩, 서울 서초구 잠원동 76-5, 서울, 서초구, 반포3동, 137909, 127.0009997940777, 37.50613653369736
5689,정성학원, 서울 성북구 장위로38길 67, , 서울 성북구 장위동 68-141, 서울, 성북구, 장위2동, 136829, 127.05154078843972, 37.610381472628355
5690,정솔학원, 서울 영등포구 도신로 115, 명신빌딩, 서울 영등포구 도림동 138-42, 서울, 영등포구, 도림동, 150830, 126.90458249781359, 37.50831807628791
5691,정수보습본관학원, 서울 강남구 언주로172길 30, , 서울 강남구 신사동 643-11, 서울, 강남구, 압구정동, 135896, 127.03622446624284, 37.52725411031261
5692,정수보습학원, 서울 광진구 뚝섬로 646, , 서울 광진구 자양동 652-3, 서울, 광진구, 자양2동, 143872, 127.08115998252926, 37.53141963379921
5693,정수보습학원, 서울 노원구 동일로197길 21, 우성빌딩, 서울 노원구 공릉동 312-4, 서울, 노원구, 공릉1동, 139801, 127.07023600962901, 37.62840599643902
5694,정수정영어학원, 서울 송파구 백제고분로23길 34, 신일갈비, 서울 송파구 삼전동 26, 서울, 송파구, 삼전동, 138837, 127.09233465000273, 37.50673475809725
5695,정수학논술보습학원, 서울 강동구 양재대로81길 26, 동성빌딩, 서울 강동구 성내동 442-9, 서울, 강동구, 성내3동, 134846, 127.13282174958022, 37.523137678885675
5696,정수학보습학원, 서울 강동구 양재대로81길 39, 이노빌딩, 서울 강동구 성내동 449-4, 서울, 강동구, 성내3동, 134847, 127.13196664463257, 37.52320350956915
5697,정수학원, 서울 강남구 삼성로72길 3, 월드스포츠센타, 서울 강남구 대치동 961-15, 서울, 강남구, 대치2동, 135847, 127.05939678052988, 37.50266895241461
5698,정수학원, 서울 영등포구 양산로 186, 백상빌딩, 서울 영등포구 영등포동6가 25-8, 서울, 영등포구, 영등포동, 150036, 126.90368175317269, 37.5227514200111
5699,정수학학원, 서울 강남구 개포로22길 90, , 서울 강남구 개포동 1183, 서울, 강남구, 개포4동, 135961, 127.05269125466847, 37.475011196322086
5700,정수학학원, 서울 노원구 한글비석로 227, 이진빌딩, 서울 노원구 중계동 360-14, 서울, 노원구, 중계1동, 139860, 127.07625092234436, 37.64791038525248
5701,정실보습학원, 서울 중랑구 봉화산로21길 14-7, , 서울 중랑구 중화동 86-3, 서울, 중랑구, 중화1동, 131875, 127.08234703118414, 37.60258665535574
5702,정쎈수학보습학원, 서울 성동구 뚝섬로 392, , 서울 성동구 성수동2가 336-48, 서울, 성동구, 성수2가1동, 133828, 127.05420709049596, 37.538877346114546
5703,정연국어전문학원, 서울 금천구 시흥대로41길 3, , 서울 금천구 시흥동 985-6, 서울, 금천구, 시흥1동, 153863, 126.90266615515807, 37.44760291190163
5704,정영어&안진광선생의파워플러스영어학원, 서울 서초구 서초중앙로33길 6-6, 신청담빌딩, 서울 서초구 반포동 52-3, 서울, 서초구, 반포4동, 137803, 127.01118256378744, 37.501757121805355
5705,정오수학학원, 서울 마포구 백범로 127-22, , 서울 마포구 염리동 148-23, 서울, 마포구, 염리동, 121872, 126.94571030588926, 37.546687171640244
5706,정우보습학원, 서울 도봉구 시루봉로6길 93, , 서울 도봉구 쌍문동 218, 서울, 도봉구, 쌍문4동, 132872, 127.03263026010647, 37.65941624056395
5707,정우종수학학원, 서울 강동구 양재대로89길 27, , 서울 강동구 성내동 430-9, 서울, 강동구, 성내3동, 134890, 127.13399089951659, 37.526621432785404
5708,정원국어학원, 서울 종로구 진흥로22길 8-1, , 서울 종로구 구기동 95-16, 서울, 종로구, 평창동, 110803, 126.95830100591704, 37.60668049186278
5709,정원용과학학원, 서울 양천구 목동서로 349, 센트럴프라자, 서울 양천구 신정동 321-6, 서울, 양천구, 신정6동, 158885, 126.86530616446005, 37.51740518361339
5710,정은경학원, 서울 노원구 한글비석로 254, 대명프라자, 서울 노원구 중계동 364-22, 서울, 노원구, 중계본동, 139861, 127.07708748669603, 37.65040376278358
5711,정인(正人)학원, 서울 중랑구 면목로33길 43, 소리엘피아노, 서울 중랑구 면목동 350-2, 서울, 중랑구, 면목4동, 131826, 127.08345488812625, 37.57651116347048
5712,정인보습학원, 서울 강남구 일원로 95, 신영프라자, 서울 강남구 일원동 715-1, 서울, 강남구, 일원본동, 135230, 127.08352567271152, 37.48573705295261
5713,정인보습학원, 서울 영등포구 시흥대로175가길 16, , 서울 영등포구 대림동 993-49, 서울, 영등포구, 대림2동, 150823, 126.90302976044282, 37.48808381965557
5714,정인수학학원, 서울 종로구 창의문로10길 11, 일민빌딩, 서울 종로구 부암동 230, 서울, 종로구, 부암동, 110817, 126.96425507052062, 37.59387756502108
5715,정일보습학원, 서울 송파구 거마로8길 25, 성진빌딩, 서울 송파구 거여동 235, 서울, 송파구, 거여2동, 138815, 127.14756454722526, 37.493473541086644
5716,정일학원, 서울 노원구 노원로 456, 백암빌딩, 서울 노원구 상계동 371-2, 서울, 노원구, 상계2동, 139816, 127.06672752911457, 37.65745215613398
5717,정임학원, 서울 은평구 은평로3길 23, 예림빌딩, 서울 은평구 역촌동 84-1, 서울, 은평구, 역촌동, 122903, 126.91496407365209, 37.60100621360585
5718,정재현알토란보습학원, 서울 송파구 백제고분로 203, 문화빌딩, 서울 송파구 삼전동 7-9, 서울, 송파구, 삼전동, 138837, 127.08939554503753, 37.504188976782196
5719,정주보습학원, 서울 강동구 동남로71길 38, 동양타워, 서울 강동구 명일동 48-12, 서울, 강동구, 명일2동, 134825, 127.15406715046494, 37.552041168749966
5720,정준수학학원, 서울 마포구 월드컵북로 375, DMC 이안상암1단지, 서울 마포구 상암동 1654, 서울, 마포구, 상암동, 121904, 126.89072371799274, 37.57757488178521
5721,정진백년대계학원, 서울 노원구 한글비석로 271, 태경빌딩, 서울 노원구 중계동 359-20, 서울, 노원구, 중계1동, 139860, 127.0770573814498, 37.65197509642511
5722,정진수수학보습학원, 서울 강동구 동남로71길 14, 한양빌딩, 서울 강동구 명일동 48-16, 서울, 강동구, 명일2동, 134825, 127.1553615805493, 37.551938560964835
5723,정진수학학원, 서울 강남구 도곡로78길 22, 대치삼성아파트, 서울 강남구 대치동 1014-3, 서울, 강남구, 대치1동, 135968, 127.05884919636631, 37.49663608993374
5724,정진우수학학원, 서울 노원구 한글비석로 273, 대웅빌딩, 서울 노원구 중계동 359-8, 서울, 노원구, 중계1동, 139860, 127.07722076317003, 37.652169601842445
5726,정진학원, 서울 종로구 평창12길 3, 나라빌딩, 서울 종로구 평창동 182-11, 서울, 종로구, 평창동, 110847, 126.96722539941635, 37.60617875339529
5727,정찬영어보습학원, 서울 송파구 마천로8길 5, 진성빌딩, 서울 송파구 오금동 42-9, 서울, 송파구, 오금동, 138856, 127.12765440103735, 37.50730374046064
5728,정철거마영어학원, 서울 송파구 성내천로 256-1, , 서울 송파구 마천동 200-42, 서울, 송파구, 마천1동, 138819, 127.1539869562884, 37.49762799200052
5729,정철영어뉴스터디학원, 서울 구로구 개봉로20길 6, 현대아파트1단지, 서울 구로구 개봉동 481, 서울, 구로구, 개봉2동, 152755, 126.8593072877927, 37.49288005230854
5730,정통학원, 서울 서대문구 증가로 191, 남가좌삼성아파트, 서울 서대문구 남가좌동 377, 서울, 서대문구, 남가좌2동, 120762, 126.91738969626873, 37.57849394438817
5731,정학원, 서울 서대문구 세검정로1길 93, 홍은동벽산아파트, 서울 서대문구 홍은동 455, 서울, 서대문구, 홍은1동, 120100, 126.94554424454265, 37.594493901702336
5732,정한학원, 서울 송파구 거마로 88, 정호빌딩, 서울 송파구 마천동 49-14, 서울, 송파구, 마천2동, 138818, 127.14798094835905, 37.500486449398494
5733,정향학원, 서울 강남구 도곡로70길 5, , 서울 강남구 대치동 1023-19, 서울, 강남구, 대치1동, 135500, 127.05662396296376, 37.49699397604059
5734,정현국어학원, 서울 광진구 자양번영로4길 8, , 서울 광진구 자양동 600-2, 서울, 광진구, 자양2동, 143865, 127.07576557677729, 37.531387177712176
5735,정현석수학명가학원, 서울 송파구 백제고분로19길 31, 서경빌딩, 서울 송파구 잠실동 241-3, 서울, 송파구, 잠실본동, 138864, 127.08747244187887, 37.507661087520034
5736,정현수학학원, 서울 양천구 목동동로8길 23, 메리트원, 서울 양천구 신정동 282-2, 서울, 양천구, 신정2동, 158852, 126.87148775199243, 37.5168570533875
5737,정현아카데미학원, 서울 중랑구 봉화산로 52, 용우빌딩, 서울 중랑구 중화동 287-14, 서울, 중랑구, 중화1동, 131876, 127.08022131218347, 37.601424039928176
5738,정현영어학원, 서울 강남구 도곡로 405, 삼환 아르누보2, 서울 강남구 대치동 938-24, 서울, 강남구, 대치4동, 135998, 127.05467012679208, 37.49736971506252
5739,정호올림피아드보습학원, 서울 관악구 남부순환로 1517, , 서울 관악구 신림동 507-23, 서울, 관악구, 신사동, 151872, 126.91910955014683, 37.48295657297092
5740,제1관인앤지보습학원, 서울 동작구 상도로 73, 보광빌딩, 서울 동작구 대방동 335-25, 서울, 동작구, 대방동, 156808, 126.92891648883368, 37.49989821248947
5742,제2과수원과학수학전문학원, 서울 노원구 중계로 201, 오성프라자, 서울 노원구 중계동 364-24, 서울, 노원구, 중계본동, 139861, 127.07778105558963, 37.6504681783022
5743,제2관YCD보습학원, 서울 성동구 광나루로2길 27, 모래알유치원, 서울 성동구 성수동2가 299-42, 서울, 성동구, 성수2가3동, 133833, 127.05462160992725, 37.548726879680274
