3653,아드지스영어학원, 서울 강남구 삼성로 212, 은마아파트, 서울 강남구 대치동 316, 서울, 강남구, 대치2동, 135969, 127.06591733758967, 37.49961649024463
3654,아드폰테스2관학원, 서울 양천구 목동중앙로 73, , 서울 양천구 목동 762-10, 서울, 양천구, 목4동, 158817, 126.8705359303763, 37.536144653490325
3655,아드폰테스수학학원, 서울 양천구 목동중앙로 73, , 서울 양천구 목동 762-10, 서울, 양천구, 목4동, 158817, 126.8705359303763, 37.536144653490325
3656,아라해법학원, 서울 노원구 동일로216길 70, 상계주공4단지아파트, 서울 노원구 상계동 751-4, 서울, 노원구, 상계6.7동, 139754, 127.06549437242599, 37.65212263601553
3657,아람플러스학원, 서울 서초구 서운로 43, 서암빌딩, 서울 서초구 서초동 1344-10, 서울, 서초구, 서초2동, 137861, 127.02830845492599, 37.487648095082214
3658,아레네스수학전문학원, 서울 서초구 서초대로25길 16-1, 쌍계빌딩, 서울 서초구 방배동 876-9, 서울, 서초구, 방배4동, 137840, 126.99407047453504, 37.48868929885111
3659,아레테국어논술학원, 서울 양천구 목동서로 349, 센트럴프라자, 서울 양천구 신정동 321-6, 서울, 양천구, 신정6동, 158885, 126.86530616446005, 37.51740518361339
3660,아레테아카데미(Arete Academy)학원, 서울 강남구 도산대로27길 25, , 서울 강남구 신사동 564-6, 서울, 강남구, 신사동, 135891, 127.02725336241897, 37.521486502006475
3661,아론스키위영어보습학원, 서울 송파구 오금로46길 18-1, , 서울 송파구 가락동 174-25, 서울, 송파구, 가락2동, 138811, 127.13506675423726, 37.49585993916785
3662,아르뉴가수학학원, 서울 양천구 목동서로 349, 센트럴프라자, 서울 양천구 신정동 321-6, 서울, 양천구, 신정6동, 158885, 126.86530616446005, 37.51740518361339
3663,아르케학원, 서울 노원구 한글비석로 273, 대웅빌딩, 서울 노원구 중계동 359-8, 서울, 노원구, 중계1동, 139860, 127.07722076317003, 37.652169601842445
3664,아름드리수학학원, 서울 양천구 오목로54길 8, , 서울 양천구 목동 405-70, 서울, 양천구, 목1동, 158806, 126.873176762288, 37.52408852242385
3665,아리쌤수학보습학원, 서울 송파구 백제고분로46길 39, , 서울 송파구 송파동 145-13, 서울, 송파구, 송파1동, 138852, 127.11521743311867, 37.507024600586014
3666,아벨보습학원, 서울 관악구 남부순환로 1915, , 서울 관악구 봉천동 1685-21, 서울, 관악구, 행운동, 151849, 126.96220753018186, 37.477914547966996
3667,아벨수학전문학원, 서울 서초구 효령로2길 59, , 서울 서초구 방배동 483-5, 서울, 서초구, 방배3동, 137821, 126.98965338835856, 37.475710863211404
3668,아벨수학학원, 서울 동작구 사당로16길 27, 경남빌딩, 서울 동작구 사당동 316-1, 서울, 동작구, 사당4동, 156823, 126.97311366951055, 37.48219912843823
3669,아벨에듀보습학원, 서울 관악구 행운1길 50, , 서울 관악구 봉천동 1671-4, 서울, 관악구, 행운동, 151834, 126.95710920324666, 37.48097263452738
3670,아샘학원, 서울 동작구 상도로31길 19, 브라운스톤상도아파트, 서울 동작구 상도동 527, 서울, 동작구, 상도2동, 156748, 126.94454076363637, 37.506235243728185
3671,아세아보습논술학원, 서울 성북구 성북로4길 52, 한신 아파트, 서울 성북구 돈암동 609-1, 서울, 성북구, 돈암2동, 136753, 127.00940262417231, 37.59290592791272
3672,아스카일본어학원, 서울 은평구 서오릉로 115, , 서울 은평구 역촌동 2-136, 서울, 은평구, 역촌동, 122895, 126.9192532706543, 37.60977765849703
3673,아스트라수학전문학원, 서울 노원구 중계로 220, 조충빌딩, 서울 노원구 중계동 359-15, 서울, 노원구, 중계1동, 139860, 127.07568282887331, 37.65087318338606
3674,아우다키아보습학원, 서울 서초구 고무래로10길 19, , 서울 서초구 반포동 53-4, 서울, 서초구, 반포4동, 137803, 127.01025510317209, 37.50099675697095
3675,아우라(aura)학원, 서울 노원구 공릉로35길 2, 영남빌딩, 서울 노원구 공릉동 338-6, 서울, 노원구, 공릉2동, 139802, 127.0791614904112, 37.62291874300367
3676,아우라에듀학원, 서울 강남구 삼성로67길 21, , 서울 강남구 대치동 929, 서울, 강남구, 대치4동, 135998, 127.05774858901711, 37.5006587248046
3677,아워스터디(Our Study)학원, 서울 강남구 남부순환로 2927, 대치 클래시아, 서울 강남구 대치동 622, 서울, 강남구, 대치1동, , 127.06035762380232, 37.49367642276627
3678,아이겐수학학원, 서울 서초구 신반포로3길 8, 반포프라자, 서울 서초구 반포동 1313, 서울, 서초구, 반포본동, 137813, 126.98690384829973, 37.502138951629824
3679,아이글로벌리더아카데미1학원, 서울 강서구 까치산로10길 8, , 서울 강서구 화곡동 61-30, 서울, 강서구, 화곡본동, 157871, 126.84522267199893, 37.54303386394537
3680,아이넷사이버스쿨원격학원, 서울 영등포구 가마산로34길 3, 우성빌딩, 서울 영등포구 대림동 775-16, 서울, 영등포구, 대림3동, 150816, 126.8964209147455, 37.49859115735368
3681,아이두영수전문학원, 서울 마포구 월드컵북로 336, , 서울 마포구 상암동 34-46, 서울, 마포구, 상암동, 121830, 126.89467450794996, 37.576057595039146
3682,아이두영수전문학원, 서울 영등포구 양평로20길 17, 송전빌딩, 서울 영등포구 양평동4가 233-3, 서울, 영등포구, 양평2동, 150867, 126.89609409455348, 37.5385629629358
3683,아이디엠(IDM)학원, 서울 양천구 신목로7길 5, , 서울 양천구 신정동 296-16, 서울, 양천구, 신정2동, 158852, 126.87169104525735, 37.519682819003286
3684,아이디영어학원, 서울 구로구 개봉로16길 26, 개봉동미래빌딩, 서울 구로구 개봉동 265-1, 서울, 구로구, 개봉3동, 152811, 126.85769800987366, 37.48998769534701
3685,아이리드영어독서보습학원, 서울 송파구 삼전로 89, 영빌딩, 서울 송파구 잠실동 252-2, 서울, 송파구, 잠실본동, 138864, 127.08944359963228, 37.50654957355327
3686,아이리드영어독서전문학원, 서울 도봉구 방학로 169, , 서울 도봉구 방학동 670-2, 서울, 도봉구, 방학3동, 132932, 127.0334112063508, 37.66215860958755
3687,아이맥스보습학원, 서울 관악구 청룡길 30, , 서울 관악구 봉천동 915-26, 서울, 관악구, 청룡동, 151841, 126.94593009254856, 37.48048150271216
3688,아이맥스보습학원, 서울 영등포구 가마산로79길 46, , 서울 영등포구 신길동 4936, 서울, 영등포구, 신길7동, 150857, 126.91824985455982, 37.50823101727698
3689,아이맥스수학학원, 서울 은평구 불광로 119, 불광빌딩, 서울 은평구 불광동 222-1, 서울, 은평구, 불광1동, 122855, 126.93295026085666, 37.61750590546944
3690,아이맥학원, 서울 구로구 오리로 1290, 삼덕빌딩, 서울 구로구 궁동 169-15, 서울, 구로구, 수궁동, 152883, 126.82974881939579, 37.49672268688179
3691,아이멕스영어수학전문보습학원, 서울 강동구 양재대로 1383, , 서울 강동구 성내동 415-7, 서울, 강동구, 성내3동, 134844, 127.13656676629495, 37.529671074235296
3692,아이블영어보습학원, 서울 송파구 마천로 74, 남성빌딩, 서울 송파구 오금동 41-25, 서울, 송파구, 오금동, 138856, 127.12841468853759, 37.50745068111253
3693,아이비(IVY)예일보습학원, 서울 광진구 자양로 43, , 서울 광진구 자양동 677-7, 서울, 광진구, 자양2동, 143873, 127.08553645202065, 37.531708469434726
3694,아이비리그학원, 서울 강남구 남부순환로 2912, , 서울 강남구 대치동 500, 서울, 강남구, 대치1동, 135280, 127.05614429789215, 37.49070517644355
3695,아이비바운드학원, 서울 강남구 영동대로131길 16, , 서울 강남구 청담동 70-11, 서울, 강남구, 청담동, 135953, 127.05490875977395, 37.5205614639968
3696,아이비보습학원, 서울 노원구 덕릉로 698, 광현빌딩, 서울 노원구 중계동 152-5, 서울, 노원구, 중계4동, 139856, 127.07565566063653, 37.65983617126688
3697,아이비보습학원, 서울 동작구 사당로16길 28, , 서울 동작구 사당동 274-12, 서울, 동작구, 사당4동, 156821, 126.97290103990602, 37.48239730179894
3698,아이비보습학원, 서울 성동구 마장로 137, 텐즈힐, 서울 성동구 상왕십리동 811, 서울, 성동구, 왕십리도선동, 133010, 127.0250516712042, 37.567823580170504
3699,아이비셉트학원, 서울 강남구 논현로175길 63, , 서울 강남구 신사동 550-8, 서울, 강남구, 신사동, 135890, 127.02388765389753, 37.52400643402226
3700,아이비스영어학원, 서울 송파구 가락로 272, , 서울 송파구 방이동 160-2, 서울, 송파구, 방이1동, 138833, 127.11965450494849, 37.51208022871463
3701,아이비스학원, 서울 강남구 삼성로 331, , 서울 강남구 대치동 931-19, 서울, 강남구, 대치4동, 135998, 127.05934132330336, 37.50118772690754
3702,아이비아카데미학원, 서울 동대문구 천호대로91길 42, , 서울 동대문구 장안동 443-4, 서울, 동대문구, 장안1동, 130845, 127.06972218934519, 37.56339437416232
3703,아이비어드밴스학원, 서울 강남구 압구정로30길 70, , 서울 강남구 신사동 592-13, 서울, 강남구, 압구정동, 135893, 127.02880590794337, 37.522816013555556
3704,아이비영재학원, 서울 강서구 양천로 655, 시성학원, 서울 강서구 염창동 244-38, 서울, 강서구, 염창동, 157861, 126.87017639868375, 37.55295689474033
3705,아이비전아카데미신내학원, 서울 중랑구 봉화산로53길 19, , 서울 중랑구 신내동 614, 서울, 중랑구, 신내1동, 131867, 127.09696794339763, 37.60860857490977
3706,아이비젠코리아학원, 서울 강남구 언주로151길 18, , 서울 강남구 신사동 628-38, 서울, 강남구, 압구정동, 135895, 127.03175134011772, 37.52206562424117
3707,아이비주니어학원, 서울 노원구 동일로178길 39-11, , 서울 노원구 공릉동 585-12, 서울, 노원구, 공릉1동, 139807, 127.07645554961742, 37.622019540106294
3708,아이비탑리딩영어독서학원, 서울 양천구 목동동로 385, 벽산미라지타워, 서울 양천구 목동 907-14, 서울, 양천구, 목5동, 158730, 126.87949733468787, 37.53590185771696
3709,아이비티영어학원, 서울 영등포구 당산로44길 3, 삼성타운, 서울 영등포구 당산동5가 11-34, 서울, 영등포구, 당산2동, 150045, 126.90107685409343, 37.531914255198544
3710,아이비티주니어보습학원, 서울 강동구 고덕로 140, 프라이어팰리스, 서울 강동구 암사동 413-3, 서울, 강동구, 암사1동, 134050, 127.14074049194033, 37.55445806224201
3711,아이비프랩(IB PREP)학원, 서울 강남구 압구정로34길 34, 성우 에스, 서울 강남구 신사동 608-14, 서울, 강남구, 압구정동, 135894, 127.03048590047545, 37.52584295983594
3712,아이비학원, 서울 강북구 삼양로 254, 래미안미아1차아파트, 서울 강북구 미아동 797-1, 서울, 강북구, 삼양동, 142823, 127.0184782846301, 37.62604684883239
3713,아이비학원, 서울 구로구 개봉로20길 6, 현대아파트1단지, 서울 구로구 개봉동 481, 서울, 구로구, 개봉2동, 152755, 126.8593072877927, 37.49288005230854
3714,아이수박씨원격학원, 서울 구로구 디지털로33길 48, 대륭포스트타워7차, 서울 구로구 구로동 170-10, 서울, 구로구, , 152847, 126.89450532184752, 37.48725840062864
3715,아이스터디영어학원, 서울 서초구 사평대로 18, 학림빌딩, 서울 서초구 방배동 750-12, 서울, 서초구, 방배본동, 137828, 126.98641600279433, 37.49818888582225
3716,아이스트학원, 서울 강남구 도곡로77길 5, , 서울 강남구 대치동 940-7, 서울, 강남구, 대치4동, 135999, 127.0583803388512, 37.49865818084199
3717,아이쎈영어보습학원, 서울 강동구 동남로67길 38, , 서울 강동구 명일동 248-5, 서울, 강동구, 명일2동, 134827, 127.15367132692388, 37.54886296514404
3718,아이씨유영어학원, 서울 강남구 도곡로73길 13, , 서울 강남구 대치동 934-13, 서울, 강남구, 대치4동, 135998, 127.05696906931387, 37.498741762413744
3719,아이앤피아카데미학원, 서울 강남구 논현로159길 16, , 서울 강남구 신사동 567-27, 서울, 강남구, 신사동, 135891, 127.02681957756072, 37.523173278331306
3720,아이에스엘보습학원, 서울 관악구 신림로 136, , 서울 관악구 신림동 116-22, 서울, 관악구, 서림동, 151927, 126.93467692324076, 37.471721607599555
3721,아이에스이(ISE)영어학원, 서울 강남구 삼성로64길 45, 탐스코빌딩, 서울 강남구 대치동 977-13, 서울, 강남구, 대치2동, 135842, 127.06395977094611, 37.50094745109277
3722,아이에스펠릭스학원, 서울 은평구 연서로27길 12, 효성빌딩, 서울 은평구 갈현동 454-28, 서울, 은평구, 갈현2동, 122959, 126.9181977022978, 37.618073233282196
3723,아이에이(IA)수학전문학원, 서울 성북구 동소문로 57, , 서울 성북구 동소문동4가 121, 서울, 성북구, 성북동, 136034, 127.01178926876311, 37.59135240340379
3724,아이엔지(InG)학원, 서울 강남구 역삼로 417, , 서울 강남구 대치동 906-23, 서울, 강남구, 대치4동, 135841, 127.05269618891579, 37.501353059125776
3725,아이엠(IM)보습학원, 서울 강동구 천중로 226, , 서울 강동구 길동 352-1, 서울, 강동구, 길동, 134812, 127.14531291441949, 37.54061319263189
3726,아이엠아이열정과끈기보습학원, 서울 양천구 목동서로 77, 현대월드타워, 서울 양천구 목동 907, 서울, 양천구, 목5동, 158735, 126.87799016265622, 37.53596157818753
3727,아이엠폴영어학원, 서울 용산구 효창원로70길 11, , 서울 용산구 효창동 5-39, 서울, 용산구, 효창동, 140896, 126.96273658607129, 37.54171665195685
3728,아이엠학원, 서울 은평구 갈현로 39, , 서울 은평구 신사동 9-17, 서울, 은평구, 신사1동, 122880, 126.91011699964001, 37.60125850301627
3729,아이엠학원, 서울 중랑구 겸재로49길 18, 신세대프라자, 서울 중랑구 면목동 100-31, 서울, 중랑구, 면목본동, 131816, 127.09049429808253, 37.58986229897001
3730,아이위영어학원, 서울 은평구 연서로 187-1, , 서울 은평구 갈현동 461-34, 서울, 은평구, 갈현2동, 122813, 126.91798284818714, 37.615687267906026
3731,아이작2관학원, 서울 중랑구 공릉로2길 13, 도림빌딩, 서울 중랑구 묵동 173-7, 서울, 중랑구, 묵1동, 131848, 127.07874240624085, 37.61221168296171
3732,아이젠보습학원, 서울 노원구 중계로16길 10, 문화빌딩, 서울 노원구 중계동 94-3, 서울, 노원구, 중계본동, 139855, 127.0813669885973, 37.650991933470706
3733,아이즈학원, 서울 성북구 서경로 55, 서륭빌딩, 서울 성북구 정릉동 192-263, 서울, 성북구, 정릉2동, 136846, 127.01522576945109, 37.60821855889977
3734,아이짱보습학원, 서울 강동구 상암로 214, 삼익맨션, 서울 강동구 명일동 270, 서울, 강동구, 명일1동, 134828, 127.14622018768668, 37.54630638459433
3735,아이캔두잇학원, 서울 양천구 지양로7길 9, , 서울 양천구 신월동 952-1, 서울, 양천구, 신월7동, 158845, 126.83308608647486, 37.52154829998286
3736,아이캔보습학원, 서울 서초구 방배로43길 21, 삼호아파트, 서울 서초구 방배동 770-1, 서울, 서초구, 방배본동, 137829, 126.98704527017372, 37.49526969505549
3738,아이콘영어학원, 서울 노원구 중계로 202, 신아프라자, 서울 노원구 중계동 366-4, 서울, 노원구, 중계본동, 139861, 127.07781316045782, 37.65082855027483
3739,아이큐베드(IQuBed)학원, 서울 성북구 종암로 167, 동일하이빌뉴시티, 서울 성북구 하월곡동 230, 서울, 성북구, 길음2동, 136130, 127.03098931309225, 37.60505840420434
3740,아이큐브학원, 서울 강남구 역삼로52길 14, 도곡프라자, 서울 강남구 역삼동 754-2, 서울, 강남구, 역삼2동, 135926, 127.0479897853406, 37.498554738009176
3742,아이티에이(ITA)학원, 서울 서초구 효령로 202, 서초빌딩, 서울 서초구 서초동 1487-3, 서울, 서초구, 서초3동, 137869, 127.00641749859273, 37.48283992746315
3743,아이팰리딩클럽학원, 서울 영등포구 당산로44길 3, 삼성타운, 서울 영등포구 당산동5가 11-34, 서울, 영등포구, 당산2동, 150045, 126.90107685409343, 37.531914255198544
3744,아이학원, 서울 동작구 상도로 311, I학원, 서울 동작구 상도1동 377, 서울, 동작구, 상도1동, 156836, 126.95051176014282, 37.500338111910544
3745,아인스일원학원, 서울 강남구 개포로 642, 영남빌딩, 서울 강남구 일원동 624-2, 서울, 강남구, 일원1동, 135943, 127.0831419902568, 37.49457440398529
3746,아인영어학원, 서울 송파구 송이로32길 14, , 서울 송파구 문정동 11-9, 서울, 송파구, 문정1동, 138824, 127.12767280096513, 37.48888355734031
3747,아주즐거운보습학원, 서울 강동구 상암로63길 48, , 서울 강동구 명일동 86, 서울, 강동구, 명일2동, 134826, 127.15421414546584, 37.54868566188694
3748,아주특별한수학학원, 서울 강남구 개포로82길 13-15, , 서울 강남구 개포동 186-6, 서울, 강남구, 개포2동, 135994, 127.06835022171929, 37.4888210456944
3749,아주특별한학원, 서울 양천구 오목로 53, , 서울 양천구 신월동 445-13, 서울, 양천구, 신월2동, 158834, 126.84345513327831, 37.5224959365072
3750,아침밥공부원격학원, 서울 강남구 언주로98길 8-2, 해주빌딩, 서울 강남구 역삼동 700-10, 서울, 강남구, 역삼1동, 135513, 127.04237059844196, 37.504784639184116
3751,아카데미리더스학원, 서울 양천구 목동서로 77, 현대월드타워, 서울 양천구 목동 907, 서울, 양천구, 목5동, 158735, 126.87799016265622, 37.53596157818753
3752,아카데미아학원, 서울 강남구 역삼로 462, , 서울 강남구 대치동 912-15, 서울, 강남구, 대치4동, 135997, 127.05780891320839, 37.502626491868305
3753,아크로수학학원, 서울 도봉구 도당로 7, , 서울 도봉구 쌍문동 20, 서울, 도봉구, 쌍문2동, 132858, 127.03477418801455, 37.65878494081263
3754,아크로영어보습학원, 서울 강동구 동남로75길 13-25, 동해빌딩, 서울 강동구 명일동 47-16, 서울, 강동구, 명일2동, 134825, 127.15547256475864, 37.55306646341982
3755,아크멘학원, 서울 도봉구 방학로10길 12, , 서울 도봉구 방학동 666-25, 서울, 도봉구, 방학2동, 132848, 127.03305798265943, 37.66302004714266
3756,아크보습학원, 서울 강남구 선릉로72길 18, , 서울 강남구 대치동 920-7, 서울, 강남구, 대치4동, 135843, 127.05266831533378, 37.50031150873708
3757,아테나고등수학학원, 서울 양천구 목동서로 67, 우성에펠타운빌딩, 서울 양천구 목동 907-4, 서울, 양천구, 목5동, 158708, 126.87855064793938, 37.536398239962146
3758,아테나수학학원, 서울 양천구 목동서로 67, 우성에펠타운빌딩, 서울 양천구 목동 907-4, 서울, 양천구, 목5동, 158708, 126.87855064793938, 37.536398239962146
3759,아토즈수리논술학원, 서울 강남구 삼성로 319, 금강빌딩, 서울 강남구 대치동 931-25, 서울, 강남구, 대치4동, , 127.05978849835924, 37.50035136797385
3760,아토즈아카데미학원, 서울 강남구 도곡로 460, 동선빌딩, 서울 강남구 대치동 1021-8, 서울, 강남구, 대치1동, 135500, 127.06062833840697, 37.49843359898051
3761,아트만수학학원, 서울 은평구 연서로 161, (주)신한방갈현동빌딩, 서울 은평구 갈현동 464-4, 서울, 은평구, 갈현2동, 122714, 126.91715190057991, 37.613272038629084
3762,아트플러스학원, 서울 강남구 언주로 120, 인스토피아, 서울 강남구 도곡동 467-23, 서울, 강남구, 도곡2동, 135856, 127.05126577786373, 37.48675377207917
3763,아특학원, 서울 양천구 남부순환로40길 87, , 서울 양천구 신월동 186-26, 서울, 양천구, 신월3동, 158830, 126.82515987621441, 37.53259031151373
3764,아하김일래수학전문학원, 서울 강남구 남부순환로 2909, 여천빌딩, 서울 강남구 대치동 651, 서울, 강남구, 대치1동, 135838, 127.0574118750373, 37.49218221925881
3765,아하한겨레교육센터학원, 서울 마포구 백범로 18, 미화빌딩, 서울 마포구 노고산동 107-104, 서울, 마포구, , 121722, 126.93689190451727, 37.55320241201531
3766,악어수학학원, 서울 송파구 동남로26길 21, , 서울 송파구 오금동 148-13, 서울, 송파구, 오금동, 138859, 127.13907254226467, 37.49972240817928
3767,안국2관대치이강학원, 서울 종로구 자하문로 30, , 서울 종로구 통의동 102, 서울, 종로구, 사직동, 110040, 126.97185179680139, 37.57878258427509
3768,안국대치이강학원, 서울 종로구 계동길 61, , 서울 종로구 계동 86, 서울, 종로구, 가회동, 110800, 126.98655964027618, 37.5800429626774
3769,안보라스터디학원, 서울 강남구 도곡로 408, 디마크 빌딩, 서울 강남구 대치동 1024, 서울, 강남구, 대치1동, 135500, 127.05523500533056, 37.49662341893901
3770,안보라언어독해학원, 서울 강남구 삼성로57길 38, , 서울 강남구 대치동 1023-11, 서울, 강남구, 대치1동, 135500, 127.05805821597245, 37.49742576296739
3771,안상욱수학학원, 서울 노원구 중계로 219, 법성프라자, 서울 노원구 중계동 360-5, 서울, 노원구, 중계1동, 139860, 127.0756733831245, 37.650498380572735
3772,안상혁수학학원, 서울 강남구 남부순환로 2941, 대치탑프라자, 서울 강남구 대치동 606-1, 서울, 강남구, 대치1동, 135835, 127.0619367060106, 37.49426306196451
3773,안샘(AnSaem)학원, 서울 송파구 가락로 156, 예빌딩, 서울 송파구 송파동 103-31, 서울, 송파구, 송파2동, 138854, 127.11303077951652, 37.50299021121776
3774,안선생보습학원, 서울 성북구 종암로 73, , 서울 성북구 종암동 17-4, 서울, 성북구, 종암동, 136858, 127.03498994864916, 37.596879894898386
3775,안쌤수학학원, 서울 종로구 평창11길 13, 다송빌딩, 서울 종로구 평창동 341, 서울, 종로구, 평창동, 110847, 126.96631006182072, 37.606791168709044
3776,안암명문보습학원, 서울 성북구 안암로 95-3, 우림빌딩, 서울 성북구 안암동5가 103-134, 서울, 성북구, 안암동, 136075, 127.03084943955463, 37.58445816898776
3777,안암보습학원, 서울 성북구 종암로19길 13, 수협종암동지점, 서울 성북구 종암동 69, 서울, 성북구, 종암동, 136861, 127.03401674690359, 37.59826049785212
3778,안재현영어전문학원, 서울 양천구 목동서로 133-2, 목동하나프라자, 서울 양천구 목동 905-34, 서울, 양천구, 목5동, 158876, 126.87598794662027, 37.53160225461432
3779,안티(T)영어학원, 서울 광진구 아차산로 484, , 서울 광진구 구의동 199-6, 서울, 광진구, 구의3동, 143821, 127.0956443894033, 37.54075396646637
3780,알고리즘서울학원, 서울 관악구 남부순환로 1502, , 서울 관악구 신림동 1570-6, 서울, 관악구, 미성동, 151899, 126.9174733295702, 37.48209768128686
3781,알과영보습학원, 서울 송파구 마천로 26, 신안빌딩, 서울 송파구 방이동 213-2, 서울, 송파구, 방이1동, 138835, 127.12375821073661, 37.509434256862846
3782,알렉스영어전문학원, 서울 마포구 월드컵로25길 55, 망원동새마을금고, 서울 마포구 망원동 423-2, 서울, 마포구, 망원2동, 121823, 126.90474136788183, 37.55771827374082
3783,알로곤영재센터학원, 서울 노원구 중계로 218, 원광빌딩, 서울 노원구 중계동 359-14, 서울, 노원구, 중계1동, 139860, 127.07600009699443, 37.650851355830014
3784,알로곤학원, 서울 노원구 중계로 218, 원광빌딩, 서울 노원구 중계동 359-14, 서울, 노원구, 중계1동, 139860, 127.07600009699443, 37.650851355830014
3785,알바트로스영어학원, 서울 강남구 삼성로64길 45, 탐스코빌딩, 서울 강남구 대치동 977-13, 서울, 강남구, 대치2동, 135842, 127.06395977094611, 37.50094745109277
3786,알바트로스학원, 서울 양천구 목동동로8길 3, , 서울 양천구 신정동 294-23, 서울, 양천구, 신정2동, 158852, 126.8706346590043, 37.51828691462222
3787,알아차림학원, 서울 송파구 백제고분로21길 34, 둥지빌딩, 서울 송파구 삼전동 16, 서울, 송파구, 삼전동, 138837, 127.09140699570419, 37.50654086253197
3788,알앤디잉글리쉬(R&D English)학원, 서울 서초구 서초중앙로33길 15, , 서울 서초구 반포동 49-1, 서울, 서초구, 반포4동, 137802, 127.01020984071434, 37.50080574762288
3789,알앤지(R&G)영어보습학원, 서울 송파구 삼전로 100, 아카데미빌딩, 서울 송파구 삼전동 1-3, 서울, 송파구, 삼전동, 138837, 127.09068366996375, 37.5069630902813
3790,알앤티키즈학원, 서울 강서구 강서로47길 169, 웨스트엔드아트센터, 서울 강서구 내발산동 750-12, 서울, 강서구, 발산1동, 157937, 126.82671816722946, 37.55345252493399
3791,알에스보습학원, 서울 강서구 등촌로39길 6, 새로나상가, 서울 강서구 등촌동 512-7, 서울, 강서구, , 157836, 126.86204176201409, 37.54559552752805
3792,알지보습학원, 서울 은평구 은평로 26, 신사동새마을금고, 서울 은평구 신사동 29-11, 서울, 은평구, 신사1동, 122882, 126.9108367743212, 37.59783888860535
